"scenename","scenecontent","ep_number"
"Beach","SISKO: It is how we describe the kind of passage that brought me here. ",401
"Observation lounge","PICARD: It is terminated.",401
"Observation lounge","SISKO: Terminated?",401
"Observation lounge","PICARD ALIEN: Our existence is disrupted whenever one of you enters the passage. ",401
"Saratoga Bridge","CONN OFFICER: Your linear nature is inherently destructive.",401
"Saratoga Bridge","OPS OFFICER: You have no regard for the consequences of your acts.",401
"Saratoga Bridge","SISKO: That's not true. We're aware that every choice we make has a consequence.",401
"Saratoga Bridge","CAPTAIN: But you claim you do not know what it will be.",401
"Saratoga Bridge","SISKO: We don't. ",401
"Fishing pond","JAKE: Then how can you take responsibility for your actions?",401
"Fishing pond","SISKO: We use past experience to help guide us. For Jennifer and me, all the experiences in our lives prepared us for the day we met on the beach, helped us recognize that we had a future together. When we married, we accepted all the consequences of that act, whatever they might be, including the consequences of you.",401
"Fishing pond","JAKE: Me?",401
"Fishing pond","SISKO: My son, Jake. ",401
"Sickbay","JENNIFER: The child with Jennifer.",401
"Sickbay","SISKO: Yes.",401
"Sickbay","JENNIFER: Linear procreation?",401
"Sickbay","SISKO: Yes. Jake is the continuation of our family.",401
"Sickbay","JENNIFER: The sound of children playing. ",401
"Baseball field","BATSMAN: Aggressive. Adversarial.  SISKO: Competition. For fun. It's a game that Jake and I play on the holodeck. It's called baseball.",401
"Baseball field","JAKE: Baseball? What is this?",401
"Baseball field","SISKO: I was afraid you'd ask that. I throw this ball to you and this other player stands between us with a bat, a stick, and he, and he tries to hit the ball in between these two white lines. No. The rules aren't important. What's important is, it's linear. Every time I throw this ball, a hundred different things can happen in a game. He might swing and miss, he might hit it. The point is, you never know. You try to anticipate, set a strategy for all the possibilities as best you can, but in the end it comes down to throwing one pitch after another and seeing what happens. With each new consequence, the game begins to take shape.",401
"Baseball field","BATSMAN: And you have no idea what that shape is until it is completed.",401
"Baseball field","SISKO: That's right. In fact, the game wouldn't be worth playing if we knew what was going to happen.",401
"Baseball field","JAKE: You value your ignorance of what is to come?",401
"Baseball field","SISKO: That may be the most important thing to understand about humans. It is the unknown that defines our existence. We are constantly searching, not just for answers to our questions, but for new questions. We are explorers. We explore our lives, day by day, and we explore the galaxy, trying to expand the boundaries of our knowledge. And that is why I am here. Not to conquer you either with weapons or with ideas, but to co-exist and learn. ",401
"Saratoga - Sisko's quarters","(Leaning over Jennifer's body.)  TACTICAL: If all you say is true, why do you exist here? ",401
"Saratoga - Sisko's quarters","First Officer's log, supplemental. We've rendezvoused with the space station at the former coordinates of the wormhole. Unfortunately, our scans have revealed no trace of either the wormhole or Dukat's ship. A few minutes ago, three Cardassian warships crossed the border, no doubt on their way to search for Dukat. ",401
"Ops","(Three warships are heading in)",401
"Ops","KIRA: Mister O'Brien, can you establish a high energy thoron field before they get into sensor range. I don't want them to be able to scan our defence systems.",401
"Ops","O'BRIEN: Aye, sir.",401
"Ops","DAX: They're hailing us.",401
"Ops","JASAD [on viewscreen]: I am Gul Jasad of the Cardassian Guard, Seventh Order. Where is our warship?",401
"Ops","KIRA: With any luck, they're in the Gamma Quadrant, on the other side of the wormhole.",401
"Ops","JASAD [on viewscreen]: What wormhole? Our sensors show no indication of a wormhole in this sector.",401
"Ops","KIRA: That's because it just collapsed.",401
"Ops","JASAD [on viewscreen]: What?",401
"Ops","DAX: We believe it was artificially created. That may be why our sensors never picked up any of the usual quantum fluctuation patterns.",401
"Ops","JASAD [on viewscreen]: You expect me to believe that someone created a wormhole, and now conveniently has disassembled it?",401
"Ops","KIRA: That's exactly what I expect you to believe.",401
"Ops","(Transmission ends)",401
"Ops","DAX: They're flooding subspace with anti-lepton interference. It'll cut off our communications with Starfleet.",401
"Ops","O'BRIEN: They're powering up their forward phasers.",401
"Ops","KIRA: Red alert. Shields up.",401
"Ops","O'BRIEN: What shields?",401
"Ops","DAX: They're hailing us again.",401
"Ops","KIRA: Open the channel.",401
"Ops","JASAD [on viewscreen]: We do not accept your explanation. Somehow you have destroyed our warship.",401
"Ops","KIRA: Gul Jasad, I assure you.",401
"Ops","JASAD [on viewscreen]: We demand the unconditional surrender of this space station or we will open fire.",401
"Ops","KIRA: I need at least a day to make the necessary preparations.",401
"Ops","JASAD [on viewscreen]: You have one hour.",401
"Ops","(Transmission ends)",401
"Ops","O'BRIEN: I can transfer all available power to establish partial shields around critical areas, but if they hit the docking ring we'll sustain heavy damage.",401
"Ops","KIRA: Constable, if you would coordinate moving all personnel to safer locations.",401
"Ops","(Odo leaves)",401
"Ops","KIRA: What was the last reported position of the Enterprise?",401
"Ops","DAX: At least twenty hours away.",401
"Ops","KIRA: We've got to hold out till they get here.",401
"Ops","BASHIR: I can't believe the Cardassians would ever attack a Federation outpost.",401
"Ops","O'BRIEN: Doctor, you ever studied your military history of the border wars?",401
"Ops","BASHIR: Yes.",401
"Ops","O'BRIEN: You ever heard of the Setlik Three massacre?",401
"Ops","KIRA: I assume, Mister O'Brien, you would agree surrender is not a preferable option.",401
"Ops","O'BRIEN: You know what they do to their prisoners, sir. ",401
"Saratoga - Sisko's quarters","SISKO: What is the point of bringing me back again to this?",401
"Saratoga - Sisko's quarters","JAKE: We do not bring you here.",401
"Saratoga - Sisko's quarters","JENNIFER: You bring us here.",401
"Saratoga - Sisko's quarters","TACTICAL: You exist here.",401
"Saratoga - Sisko's quarters","SISKO: Then give me the power to lead you somewhere else. Anywhere else.",401
"Saratoga - Sisko's quarters","OPAKA: We cannot give you what you deny yourself. Look for solutions from within, Commander.",401
"Saratoga - Sisko's quarters","SISKO: I was ready to die with her.",401
"Saratoga - Sisko's quarters","TACTICAL: Die? What is this?",401
"Saratoga - Sisko's quarters","JENNIFER: The termination of their linear existence.",401
"Saratoga - Sisko's quarters","(and she puts her hand on his cheek)",401
"Saratoga - Sisko's quarters","TACTICAL: We've got to go now, sir.",401
"Saratoga - Sisko's quarters","SISKO 2: Damn it, we just can't leave her here. Oh, no!",401
"Saratoga - Sisko's quarters","SISKO: I never left this ship.",401
"Saratoga - Sisko's quarters","JENNIFER: You exist here.",401
"Saratoga - Sisko's quarters","SISKO: I exist here. I don't know if you can understand. I see her like this every time I close my eyes. In the darkness, in the blink of an eye, I see her like this.",401
"Saratoga - Sisko's quarters","JENNIFER: None of your past experiences helped prepare you for this consequence.",401
"Saratoga - Sisko's quarters","SISKO: And I have never figured out how to live without her.",401
"Saratoga - Sisko's quarters","JENNIFER: So you choose to exist here. It is not linear.",401
"Saratoga - Sisko's quarters","SISKO: No. It's not linear.",401
"Saratoga - Sisko's quarters","(and he finally starts to grieve properly) ",401
"Ops","DAX: Their lead ship is hailing us Gul Jasad wants an answer.",401
"Ops","KIRA: Are you ready, Mister O'Brien?",401
"Ops","O'BRIEN: Yes, sir. When they penetrate our thoron field, it should raise a few eyebrows over there.",401
"Ops","KIRA: All right, then, let's give them our answer. Fire six photon torpedoes across Jasad's bow.",401
"Ops","O'BRIEN: We only have six photons, Major.",401
"Ops","KIRA: We're not going to win this battle with torpedoes, Chief.",401
"Ops","O'BRIEN: Aye, sir.",401
"Ops","(Six torpedoes fly off)",401
"Ops","O'BRIEN: An urgent hail from Jasad.",401
"Ops","BASHIR: Looks like we got his attention.",401
"Ops","KIRA: On screen.",401
"Ops","JASAD [on viewscreen]: This is your answer?",401
"Ops","KIRA: You don't think Starfleet took command of this space station without the ability to defend it, do you?",401
"Ops","JASAD [on viewscreen]: Defend it? Your space station could not defend itself against one Cardassian warship.",401
"Ops","KIRA: You're probably right, Jasad. And if you were dealing with a Starfleet officer, they'd probably admit we have a hopeless cause here. But I am just a Bajoran who's been fighting a hopeless cause against the Cardassians all her life. So if you want a war, I'll give you one.",401
"Ops","(transmission ends)",401
"Ops","O'BRIEN: Major. Remind me never to get into a game of Roladan Wild Draw with you. ",401
"Cardassian Bridge","CARDASSIAN 3: They were using a Thoron field to block our sensors but we were able to penetrate it.",401
"Cardassian Bridge","JASAD: What are their defences?",401
"Cardassian Bridge","CARDASSIAN 3: According to our scans, an estimated five thousand photons, integrated phaser banks on all levels.",401
"Cardassian Bridge","JASAD: When did they receive these armaments? And how did they install them without our knowledge? Somehow they have created a massive illusion of duranium shadows.",401
"Cardassian Bridge","CARDASSIAN 3: What if it is not an illusion?",401
"Cardassian Bridge","JASAD: It is!",401
"Cardassian Bridge","CARDASSIAN 3: Why risk the confrontation? The Fourth Order can be here in a day.",401
"Cardassian Bridge","JASAD: So can Starfleet. ",401
"Ops","DAX: Their lead ship is sending out a subspace message asking for reinforcements.",401
"Ops","BASHIR: Yes!",401
"Ops","KIRA: Too soon for a victory celebration, Doctor. Mister O'Brien?",401
"Ops","O'BRIEN: The ships are being deployed into a standard attack formation, sir.",401
"Ops","KIRA: Battle stations.",401
"Ops","(The Cardassians open fire) ",401
"Promenade","(Civilians on the Promenade feel the blasts)",401
"Promenade","ODO: Quickly now, quickly now. Calmly. Calmly. Come along. ",401
"Ops","O'BRIEN: They may just be testing us. I could run a pulse compression wave through the phaser banks. Put out a blast that'll make them think twice.",401
"Ops","KIRA: Do it.",401
"Ops","(One ship is hit.)",401
"Ops","KIRA: Damage report.",401
"Ops","O'BRIEN: Direct hit, level fourteen. Empty storage bays. No casualties.",401
"Ops","DAX: Shields down to twenty-seven percent.",401
"Ops","(A big bang, damage and injuries on the Promenade)",401
"Ops","DAX: A fuel conduit has ruptured on the Promenade.",401
"Ops","KIRA: Can you divert the main power flow?",401
"Ops","O'BRIEN: Controls are locked.",401
"Ops","ODO [OC]: Odo to Ops.",401
"Ops","KIRA: Go ahead.",401
"Ops","ODO [OC]: I've got wounded people down here. ",401
"Promenade","ODO: Have you seen that doctor of yours anywhere? ",401
"Ops","BASHIR: I'm on my way.",401
"Ops","(Bashir leaves)",401
"Ops","O'BRIEN: I'm going to have to shut down the primary power flow or the whole Promenade will go up. Bloody Cardassians! I just got the damned thing fixed. ",401
"Promenade","(Bashir puts Odo's hand on a neck wound)",401
"Promenade","BASHIR: Press there, hard.",401
"Promenade","ODO: Look, Doctor, maybe I should find you someone",401
"Promenade","BASHIR: Hold it there. ",401
"Ops","O'BRIEN: That should do it for awhile.",401
"Ops","DAX: Shields are at eighteen percent and falling.",401
"Ops","O'BRIEN: I might still be able to give you one more phaser blast, Major.",401
"Ops","KIRA: No. Signal the lead Cardassian ship that we will proceed with",401
"Ops","DAX: Major, I'm reading a huge neutrino disturbance fifteen kilometres off the forward docking ring. It's the wormhole.",401
"Ops","KIRA: On screen.",401
"Ops","(WHOOSH)",401
"Ops","KIRA: Hail the lead ship. What did I tell you, Jasad? ",401
"Cardassian Bridge","KIRA [OC]: There's your wormhole!",401
"Cardassian Bridge","(A runabout is towing the Cardassian warship) ",401
"Ops","SISKO [OC]: Rio Grande to DS Nine.",401
"Ops","KIRA: On screen. Go ahead, Commander.",401
"Ops","SISKO [on viewscreen]: Sorry to be late. Our friend Gul Dukat had some problems on the other side of the wormhole. I see you've had a few of your own. KIRA: A few, Commander.",401
"Ops","SISKO [on viewscreen]: Gul Dukat is signalling his ships to disarm. Clear me for docking, Mister O'Brien.",401
"Ops","O'BRIEN: Aye, sir. Cleared for pad C. ",401
"Promenade","SISKO: Casualties?",401
"Promenade","BASHIR: Thirteen injured, Commander, and no fatalities.",401
"Promenade","SISKO: Jake!",401
"Promenade","JAKE: Dad!",401
"Promenade","(They hug) ",401
"Promenade","Station log, Commander Benjamin Sisko, stardate 46393.1. The lifeforms who created the wormhole have agreed to allow safe passage for all ships traveling to the Gamma Quadrant. With the arrival of the Enterprise, the Cardassians have left the area. ",401
"Commander's office","PICARD: I suspect that the sight of their warship being towed back by a Starfleet runabout took the heart out of their fight.",401
"Commander's office","SISKO: We're not done with the Cardassians yet, not with the strategic importance of that wormhole.",401
"Commander's office","PICARD: Well, you've put Bajor on the map, Commander. This will shortly become a leading centre of commerce and scientific exploration. And for Starfleet, one of our most important posts.",401
"Commander's office","SISKO: Captain, regarding our conversation about someone to replace me.",401
"Commander's office","PICARD: Yes, I'm sorry I haven't had time yet to communicate that to Command.",401
"Commander's office","SISKO: I would prefer you ignore it, sir.",401
"Commander's office","PICARD: I'm not sure that I can. Are you certain that's what you want, because we cannot afford to have an officer who's",401
"Commander's office","SISKO: I'm certain, sir.",401
"Commander's office","(They shake hands.)",401
"Commander's office","PICARD: Good luck, Mister Sisko. ",401
"Promenade","BASHIR: (walking along with Odo) So, where can someone practice with his phaser around here?",401
"Promenade","(leaving Quarks)",401
"Promenade","QUARK: New rules?",401
"Promenade","KIRA: You're can't cheat every customer who walks through the door anymore, Quark. You are a community leader now.",401
"Promenade","QUARK: Very well, very well. Perhaps we could discuss these new rules over a drink.",401
"Promenade","KIRA: If you don't take that hand off my hip, you'll never be able to raise a glass with it again.",401
"Promenade","QUARK: Oh, I love a woman in uniform.",401
"Promenade","DAX: Benjamin, three Frunalian science vessels are requesting permission to dock.",401
"Promenade","O'BRIEN: Problem is, we've been retro-fitting the airlocks. Half of them were damaged during the move, and most of the others when the Cardassians blew out the fuel conduits.",401
"Promenade","SISKO: I guess they'll just have to transport aboard. Station ",401
"Promenade"," [Promenade] ",401
