"scenename","scenecontent","ep_number"
"Commander's office","SISKO: I want you to know I don't personally believe that you were responsible for this.",403
"Commander's office","ODO: Really? Now how can that be true? You don't know me. You have no reason to believe that I wouldn't kill Ibudan if it suited my fancy. So don't tell me there isn't some doubt inside of you, some question about whether or not I murdered the man.",403
"Commander's office","SISKO: I simply feel that putting Kira and Dax in charge of the investigation will be in everyone's best interests, including your own.",403
"Commander's office","ODO: I'll take care of my own best interests. ",403
"Promenade","MAN: That's him.",403
"Promenade","VOICE: They found his DNA. ",403
"Security office","(The place has been vandalised, with wall monitors smashed and Shifter painted in English on the wall)",403
"Security office","QUARK: I can find out who did it for you.",403
"Security office","ODO: Not for me. Tell it to Starfleet. I'm not in charge here any longer.",403
"Security office","QUARK: Well now, there's a piece of good news to brighten my day.",403
"Security office","ODO: You'd better take advantage of my absence while you can, Quark.",403
"Security office","QUARK: Oh, I will, I will. Count on it. I'll have every confidence man in the sector on board by tomorrow.",403
"Security office","ODO: You do and I'll",403
"Security office","QUARK: What?",403
"Security office","ODO: You're going get sloppy without me to keep an eye on you",403
"Security office","QUARK: I don't think so. You've kept me on my toes for far too long now.",403
"Security office","ODO: Sure. I've turned you into a better crook.",403
"Security office","QUARK: Like it or not.",403
"Security office","ODO: Quark, think you could use a shape-shifter in your organisation?",403
"Security office","QUARK: You had me going.",403
"Security office","ODO: I did, didn't I.",403
"Security office","QUARK: Yes, you did. You know, I've been asking some friends at Kran-Tobol prison about Ibudan. Whether he made any enemies while he was there. Couldn't find any. Mostly he stayed around the Bajoran dissidents that the Cardassians locked up. ",403
"Infirmary","BASHIR: It's growing exponentially. We're going to have to increase the metabolic field energy.",403
"Infirmary","SISKO: Just what is it that's growing in there?",403
"Infirmary","DAX: Aren't those DNA patterns humanoid, Julian?",403
"Infirmary","BASHIR: That's what it looks like to me, but there's a genetic drift I can't quite put my finger on.",403
"Infirmary","SISKO: What was Ibudan up to?",403
"Infirmary","BASHIR: We're going to have to wait and see what this becomes before we have a clue. You can transfer it to the larger field now.",403
"Infirmary","NURSE: Yes, Doctor.",403
"Infirmary","SISKO: (to Dax) Care for lunch?",403
"Infirmary","BASHIR: Sure.",403
"Infirmary","DAX: No, thank you. Major Kira's waiting for my report. ",403
"Quark's","BASHIR: Just how many different lives do you think she's led?",403
"Quark's","SISKO: I don't even know. He'll go, she'll go through a list of them, then out comes another one in a later conversation. I'd guess that Jadzia is probably the sixth host.",403
"Quark's","BASHIR: Has she changed much?",403
"Quark's","SISKO: Changed?",403
"Quark's","BASHIR: From the last one, Curzon Dax. I understand a Trill integrates the personality of each new host.",403
"Quark's","SISKO: I guess I'll have to find that out. If I were to tell you some of the mischief he and I got into. There was a time, I was no older than you are, we were at the running of the Rujian Steeplechase. Dax loves the races. Anyway, there were these gorgeous seven foot Ruji twin sisters that Curzon knew, and he and I. I guess we won't be doing that again soon, will we?",403
"Quark's","BASHIR: You care for her a great deal, don't you?",403
"Quark's","SISKO: Dax and I are just friends, Doctor. If you're interested, you have nothing to fear from me.",403
"Quark's","BASHIR: I mean, I were in your shoes, knowing Dax as intimately as you do, I think I'd find her hard to resist.",403
"Quark's","SISKO: You don't understand, Doctor. Dax used to beat me regularly at bare fist Juro counterpunch.",403
"Quark's","BASHIR: Well I guess you won't be doing that again soon, either.",403
"Quark's","(Odo enters, and is promptly sent to Coventry)",403
"Quark's","MAN: I'm not drinking with that scum.",403
"Quark's","VOICE: I won't drink near this man.",403
"Quark's","(Even Morn leaves Odo alone at the bar) ",403
"Schoolroom","(Desks and computers are being brought in)",403
"Schoolroom","KEIKO: In a semi-circle here, facing the module. That's right. Thank you.",403
"Schoolroom","O'BRIEN: Here's Mommy.",403
"Schoolroom","MOLLY: Where you been, Mommy?",403
"Schoolroom","KEIKO: I've been getting ready for school tomorrow, honey.",403
"Schoolroom","MOLLY: Can I come to school?",403
"Schoolroom","KEIKO: I wish you could. At least I'd know one student would be coming. But you have to wait a year or two.",403
"Schoolroom","O'BRIEN: How's it going?",403
"Schoolroom","KEIKO: We'll be ready in time. In time for what, I'm not sure. Aside from Commander Sisko, we haven't had a firm commitment from any of the parents. What's this?",403
"Schoolroom","O'BRIEN: Just a little something I replicated on the way over.",403
"Schoolroom","KEIKO: Help Mommy to open her present, Molly. Come on, pull.",403
"Schoolroom","(It's a school bell)",403
"Schoolroom","KEIKO: Oh, Miles. Thank you.",403
"Schoolroom","O'BRIEN: I want to see you standing in the Promenade tomorrow morning ringing your school bell.",403
"Schoolroom","MAN [OC]: Murderer.",403
"Schoolroom","O'BRIEN: I'd better take her home. ",403
"Promenade","(Odo is being followed by a crowd.)",403
"Promenade","CROWD: Murder. Killer.",403
"Promenade","ZAYRA: Shape-shifting freak.",403
"Promenade","(Odo retreats to the security office while the mob gathers outside.)",403
"Promenade","O'BRIEN: O'Brien to Ops. ",403
"Ops","O'BRIEN [OC]: Security to the Promenade on the double.",403
"Ops","KIRA: Acknowledged.",403
"Ops","SECURITY: Yes, sir.",403
"Ops","O'BRIEN [OC]: O'Brien to Sisko.",403
"Ops","SISKO: I'm here, Chief. What's going on?",403
"Ops","O'BRIEN [OC]: We've got a crowd, more like a mob, outside Odo's office. ",403
"Promenade","O'BRIEN: You'd better get down here. ",403
"Infirmary","(The thing Bashir's growing is about four feet long now.) ",403
"Promenade","CROWD: Freak! Shape-shifter!",403
"Promenade","ZAYRA: Freak! Murdering shifter.",403
"Promenade","SISKO: Odo's inside?",403
"Promenade","O'BRIEN: Yes sir, he went in a few minutes ago. The crowd followed him from the bar.",403
"Promenade","SISKO: I want more security here and I want them armed.",403
"Promenade","O'BRIEN: Aye, sir",403
"Promenade","(O'Brien leaves)",403
"Promenade","KIRA: It's going to be harder to control them if numbers keep growing. We can secure all turbolifts, slow down the traffic onto the Promenade.",403
"Promenade","SISKO: Good idea.",403
"Promenade","(Someone throws a piece of which breaks the Security office window, and the bearded man watches) ",403
"Infirmary","DAX: Julian, look at this.",403
"Infirmary","BASHIR: The chromatin pattern is changing.",403
"Infirmary","DAX: It's definitely humanoid.",403
"Infirmary","BASHIR: It's definitely humanoid. It's definitely. My God! Dax, I think I know what it is. Run a chromosome analysis. I think we're going to find a gene-sequence degradation. ",403
"Promenade","ZAYRA: (leading the chant) Shifter! Shifter! Shifter! Shifter!",403
"Promenade","(Phasers are being handed out.)",403
"Promenade","SISKO: Coming through. What the hell do you people intend to accomplish here?",403
"Promenade","BAJORAN: We want the shape-shifter!",403
"Promenade","SISKO: And what do you think you're going to do to him if you get to him?",403
"Promenade","CROWD: He deserves to die.",403
"Promenade","ZAYRA: He's right. How do you get a rope around the neck of a shape-shifter.",403
"Promenade","SISKO: Listen to me. You will disperse immediately. Return to your quarters. Return to your ships.",403
"Promenade","(Missiles are thrown, one hits a deputy in the face. O'Brien and Kira go hand to hand with a couple of men. Sisko shoots in the air.)",403
"Promenade","(Odo comes out)",403
"Promenade","MALE: He's a murderer. We want justice.",403
"Promenade","SISKO: Do you? Justice? Really? Is it justice you're after or just some way to express your anger, your fear. Look at yourselves! In an hour, you'll regret what you've tried to do here. Do not condemn this man because he is different than you are.",403
"Promenade","ZAYRA: We condemn him because of the evidence.",403
"Promenade","SISKO: Then take that evidence to a court of law. There will be no justice served here today.",403
"Promenade","BASHIR: Commander! Commander Sisko. I believe we have some new evidence to consider. The man who was murdered was not Ibudan.",403
"Promenade","ODO: What?",403
"Promenade","BASHIR: Come with me.",403
"Promenade","O'BRIEN: All right. break it up now.",403
"Promenade","KIRA: Move on, people. Let's clear the area.",403
"Promenade","SECURITY: You heard what she said. Come on, back to your quarters. Quickly, move. ",403
"Infirmary","BASHIR: A clone. That's what Ibudan was working on. Creating a clone of himself.",403
"Infirmary","ODO: And then he killed the clone to frame me for his murder.",403
"Infirmary","SISKO: How can we be sure the victim was a clone?",403
"Infirmary","DAX: A clone has identical DNA to that of the donor, but certain cloning methods cause a characteristic gene-sequence degradation which can be detected.",403
"Infirmary","BASHIR: if you know to look for it. We've matched the victim's gene-sequence with the fellow in the jar here. They're definitely both clones.",403
"Infirmary","ODO: What happens to this one?",403
"Infirmary","BASHIR: In about two days, he becomes a living, breathing member of Bajoran society.",403
"Infirmary","ODO: Let's hope he doesn't follow in his donor's footsteps.",403
"Infirmary","SISKO: What about Ibudan?",403
"Infirmary","ODO: I have an idea where to find him. ",403
"Shipboard quarters","(The bearded man in the hooded cloak enters)",403
"Shipboard quarters","LAMONAY: Computer, lights.",403
"Shipboard quarters","(A chair morphs into Odo.)",403
"Shipboard quarters","LAMONAY: Who are you? How did you get in here?",403
"Shipboard quarters","ODO: Oh, I think you know.",403
"Shipboard quarters","LAMONAY: I warn you, I'll call ship's security.",403
"Shipboard quarters","ODO: Do that. I have some interesting questions to ask them. For example, I'm especially curious to know how the name Lamonay S came to appear on this ship's passenger list yesterday.",403
"Shipboard quarters","LAMONAY: That is my name, and I arranged for transport on this vessel. What should that be so strange?",403
"Shipboard quarters","ODO: You did not arrive on this ship.",403
"Shipboard quarters","LAMONAY: No.",403
"Shipboard quarters","ODO: Well, just what ship did you arrive on, Mister Lamonay S? I can't find any record of your arrival on any vessel that has docked here in the last three weeks.",403
"Shipboard quarters","LAMONAY: I assure you, you are in error.",403
"Shipboard quarters","ODO: In fact I think you did arrive on this ship, and that you spent the last few years in prison among Bajoran dissidents, one of whom I've learned was a scientist who was arrested by the Cardassians for conducting experimental research into tri-phasic cloning.",403
"Shipboard quarters","(Odo stops Lamonay leaving and pulls off a mask to reveal Ibudan)",403
"Shipboard quarters","ODO: Killing your own clone is still murder. ",403
"Shipboard quarters","Commander's log, stardate 46421.5. Ibudan has been turned over to the Bajoran authorities just hours after his clone gained consciousness and began a new life. The perpetrators of the mob violence have retreated into their own business. To my knowledge, Odo has received no apologies. Meanwhile, life on the station has begun to return to normal. ",403
"Schoolroom","KEIKO: Computer what time is it?",403
"Schoolroom","COMPUTER: Oh nine oh seven hours.",403
"Schoolroom","(Sisko arrives with Jake.)",403
"Schoolroom","KEIKO: I guess you were right. It isn't going to be easy.",403
"Schoolroom","SISKO: Maybe it's just going to take a little time to",403
"Schoolroom","ROM: Sit down! Not next to that human boy. I don't want you to have anything to do with him.",403
"Schoolroom","(Nog sits as far away as possible.)",403
"Schoolroom","ROM: We'll try it for a few weeks.",403
"Schoolroom","(Rom leaves, and a couple of little Bajoran children arrive.)",403
"Schoolroom","KEIKO: Please, come in. Take any seat. Try to be on time from now on. My name is Keiko O'Brien, I'll be your teacher. Why don't we turn on our computers and access the files on Bajor to find out a little bit more about the people and history of this world? ",403
"Schoolroom"," [Schoolroom] ",403
