"scenename","scenecontent","ep_number"
"Holosuite","(Dax appears to be meditating as a large balloon floats in front of her)",403
"Holosuite","DAX: Do you need me, Julian?",403
"Holosuite","BASHIR: How did you know it was me?",403
"Holosuite","DAX: There are different ways to recognise someone. The rhythm of their steps, for example.",403
"Holosuite","BASHIR: You are remarkable.",403
"Holosuite","DAX: Julian, you and I have to have a talk about Trills and relationships.",403
"Holosuite","BASHIR: Fine. We'll do it over supper. Quark has found me this delightfully dry champagne estate bottled on Korris One.",403
"Holosuite","DAX: Julian.",403
"Holosuite","BASHIR: What is this?",403
"Holosuite","DAX: An Altonian brain teaser.",403
"Holosuite","BASHIR: A brain teaser?",403
"Holosuite","DAX: A puzzle.",403
"Holosuite","BASHIR: A puzzle? I love puzzles. How does it work?",403
"Holosuite","DAX: It responds to neural theta waves. The goal is to turn the sphere into a solid colour.",403
"Holosuite","BASHIR: That's all?",403
"Holosuite","DAX: That's all. I've been trying to master it on and off for, oh, a hundred and forty years. Would you care to try?",403
"Holosuite","BASHIR: Yes.",403
"Holosuite","DAX: Just sit comfortably, and release your tension into my hands.",403
"Holosuite","Dax strokes his head)",403
"Holosuite","BASHIR: Your hands are cold.",403
"Holosuite","DAX: It's a peculiarity of the Trill.",403
"Holosuite","BASHIR: Cold hands, warm heart.",403
"Holosuite","DAX: Concentrate on the sphere. Clear your mind. This requires focus and clarity of thought.",403
"Holosuite","BASHIR: I understand completely. What is that exotic scent you're wearing?",403
"Holosuite","DAX: Focus and clarity of thought.",403
"Holosuite","BASHIR: Yes, yes, I have it.",403
"Holosuite","DAX: I'm going to release it to you now, okay?",403
"Holosuite","BASHIR: Okay.",403
"Holosuite","DAX: Computer, transfer control to second player.",403
"Holosuite","(The sphere goes kaleidoscope then disappears)",403
"Holosuite","DAX: I think your mind is still a little busy, Julian.",403
"Holosuite","BASHIR: So, are you free for supper?",403
"Holosuite","(Sisko enters)",403
"Holosuite","SISKO: Ready, Dax?",403
"Holosuite","DAX: Sorry. Perhaps another time. Maybe you'd like to try again.",403
"Holosuite","SISKO: Doctor.",403
"Holosuite","(Dax and Sisko leave)",403
"Holosuite","BASHIR: Computer. Reset. ",403
"Quark's","ODO: Business is good, Quark. You're almost making an honest living.",403
"Quark's","QUARK: A lot of new faces.",403
"Quark's","ODO: The wormhole does bring them our way, doesn't it?",403
"Quark's","QUARK: Everybody wants a piece of the new frontier.",403
"Quark's","ODO: And I'm sure you've already tried to sell it to a few of them.",403
"Quark's","(Raised voices at an upstairs table)",403
"Quark's","O'BRIEN: We made the decision together.",403
"Quark's","KEIKO: Not true. That's not true. You decided and asked me to agree with it.",403
"Quark's","QUARK: Grapevine says Chief O'Brien and the missus are having problems.",403
"Quark's","ODO: I'll never understand the humanoid need to couple.",403
"Quark's","QUARK: You've never coupled?",403
"Quark's","ODO: Choose not to. Too many compromises. You want to watch the karo-net tournament, she wants to listen to music, so you compromise. You listen to music. You like Earth jazz, she prefers Klingon opera, so you compromise. You listen to Klingon opera. So here you were ready to have a nice night watching the karo-net match and you wind up spending an agonising night listening to Klingon opera.",403
"Quark's","KEIKO: That's exactly what I'm saying.",403
"Quark's","O'BRIEN: Keiko, sit down, please.",403
"Quark's","ODO: What could they be going on about like that anyway?",403
"Quark's","QUARK: She doesn't like it here.",403
"Quark's","ODO: Who does?",403
"Quark's","(Sisko and Dax are on the upper level, and Quark makes an appreciative growl)",403
"Quark's","ODO: Don't even think about it.",403
"Quark's","QUARK: I can so think about it.",403
"Quark's","ODO: You might as well try to find a drink of water on the Yadozi desert. Besides I'd say our new Commander is interested in her.",403
"Quark's","QUARK: Not at all. I know for a fact, when she was a he, you know, before she got this new body, they were old friends.",403
"Quark's","ODO: Things change.",403
"Quark's","IRUDAN: All right now, here we go.",403
"Quark's","(Odo spots someone at the Dabo table)",403
"Quark's","ODO: How long has he been here?",403
"Quark's","IBUDAN: All right, one more time.",403
"Quark's","QUARK: He came in on a transport last night. ",403
"Quark's cafe","(Sisko and Dax are at their table)",403
"Quark's cafe","WAITER: Something to eat?",403
"Quark's cafe","DAX: Just steamed azna.",403
"Quark's cafe","SISKO: Well, some things are still the same.",403
"Quark's cafe","DAX: If you'd listen to me, you would eat steamed azna too.",403
"Quark's cafe","SISKO: Dax, did I ever tell you about the meals my father used to cook for us when we were children?",403
"Quark's cafe","DAX: All the time.",403
"Quark's cafe","SISKO: Every night in my house, my dad insisted that we have supper together as a family. He would try out his new recipes on us. He used to call us his test tasters.",403
"Quark's cafe","DAX: Steamed azna will put years on your life.",403
"Quark's cafe","SISKO: Dax, I don't want years on my life if I can only eat steamed azna. Sautéed, rolloped, fricasseed, fine. But not steamed. I've missed your steamed azna.",403
"Quark's cafe","DAX: You must miss Curzon, too.",403
"Quark's cafe","SISKO: He was, you were, are a mentor, another father to me.",403
"Quark's cafe","DAX: This happens to Trills, Benjamin. Sometimes, our friendships with other species don't survive because of the change.",403
"Quark's cafe","SISKO: It won't be that way with us. It's just a little uncomfortable right now.",403
"Quark's cafe","DAX: I suggest you that allow yourself to be comfortable with your discomfort. Time can do the rest.",403
"Quark's cafe","O'BRIEN: Keiko.",403
"Quark's cafe","(Keiko is leaving, and O'Brien follows her.) ",403
"Quark's","(Back downstairs)",403
"Quark's","DABO GIRL: Dabo!",403
"Quark's","IRUDAN: All right.",403
"Quark's","ODO: I don't want you on this station.",403
"Quark's","IBUDAN: Yeah, well that's too bad, because I have every right to be here.",403
"Quark's","ODO: I decide who has rights and who doesn't on this Promenade.",403
"Quark's","IBUDAN: You'd better ask your Federation superiors about that one.",403
"Quark's","ODO: I don't have to check with anyone.",403
"Quark's","IRUDAN: Get off me.",403
"Quark's","(There's a fight and Sisko runs down to separate them.)",403
"Quark's","ODO: You have twenty-six hours to get off this station. ",403
"Promenade upper level","O'BRIEN: Look, I'm willing to ask for a transfer if that'll make you happy.",403
"Promenade upper level","KEIKO: That's not fair either. You'd have to give up your promotion.",403
"Promenade upper level","O'BRIEN: Not necessarily.",403
"Promenade upper level","KEIKO: I wish I knew the right thing to do. I'm just lost here. Starfleet doesn't need a botanist on this station.",403
"Promenade upper level","O'BRIEN: Keiko, there's a whole new quadrant on the other side of the wormhole, full of new plant life to explore.",403
"Promenade upper level","KEIKO: And ships going to explore it and I'm not on any of them.",403
"Promenade upper level","O'BRIEN: We'll be sending runabouts through the wormhole. I'll see to it you get to go.",403
"Promenade upper level","KEIKO: I don't need favours from you. I just need to be useful.",403
"Promenade upper level","O'BRIEN: Just think how much more attractive this place could be if you planted some trees and flowers on the Promenade. You could even create an arboretum from the new specimens we bring back from the Gamma Quadrant.",403
"Promenade upper level","KEIKO: Do you really want to raise your daughter in this place, Miles?",403
"Promenade upper level","KIRA [OC]: Kira to O'Brien.",403
"Promenade upper level","O'BRIEN: Go ahead.",403
"Promenade upper level","KIRA: We have a non-functional power transfer grid on level five. All the upper docking pylons are out of commission.",403
"Promenade upper level","O'BRIEN: On my way. ",403
"Promenade","(Nog has bought a confection on a stick from a kiosk)",403
"Promenade","JAKE: Hi.",403
"Promenade","NOG: What do you want, Human?",403
"Promenade","JAKE: My name's Jake.",403
"Promenade","NOG: I know who you are.",403
"Promenade","JAKE: What's yours?",403
"Promenade","NOG: Why do you care?",403
"Promenade","JAKE: Not exactly a lot of friends to choose from around here. You know what I mean.",403
"Promenade","NOG: Nog. My name's Nog. ",403
"Commander's office","ODO: His name is Ibudan. He used to run black market goods through here to the surface during the Cardassian occupation, gouging his fellow man who needed medical supplies and so forth. Some Bajorans actually considered him a hero, but I saw him let a child die when the parents couldn't afford the drug that would've saved her life. A few years back, he killed a Cardassian officer who wanted a payoff to look the other way. He went to prison for murder. I sent him there.",403
"Commander's office","SISKO: For murder? What's he doing out?",403
"Commander's office","ODO: The Provisional Government let him go. Killing a Cardassian isn't considered much of a crime nowadays.",403
"Commander's office","SISKO: Doesn't sound like there's much we can do about it.",403
"Commander's office","ODO: I can get him off my Promenade.",403
"Commander's office","SISKO: If he hasn't done anything wrong, you can't just arbitrarily force him to leave.",403
"Commander's office","ODO: Watch me.",403
"Commander's office","SISKO: Mister Odo, you're not going to take the law into your own hands.",403
"Commander's office","ODO: The law? Commander, laws change depending on who's making them. Cardassians one day, Federation the next. But justice is justice, and as long as I'm in charge of security.",403
"Commander's office","SISKO: If you can't work within the rules, I'll find someone who can. ",403
"Holosuite","(Iduban is running a sensuous programme including birdsong and a massage, when someone with a wicked looking knife cuts it short.) ",403
"Promenade","(Nog has some bugs in a matchbox.)",403
"Promenade","JAKE: What are they?",403
"Promenade","NOG: Garanian bolites. Come on.",403
"Promenade","BASHIR: I guess I know the competition now.",403
"Promenade","DAX: What are you talking about, Julian?",403
"Promenade","BASHIR: Did you have a nice dinner with Commander Sisko?",403
"Promenade","DAX: Julian, Trills do not look for romance the way humans do. In fact, we find it quite a nuisance.",403
"Promenade","BASHIR: A nuisance?",403
"Promenade","DAX: It's a weakness of the young, and although a Trill host may have these feelings occasionally, it is our wish to live on a higher plane, to try to rise above these kinds of temptations.",403
"Promenade","BASHIR: You said, try to rise above, which suggests you don't always succeed.",403
"Promenade","DAX: Julian.",403
"Promenade","SISKO [OC]: Sisko to Doctor Bashir.",403
"Promenade","BASHIR: Go ahead.",403
"Promenade","SISKO [OC]: We need medical assistance above the bar in holosuite four.",403
"Promenade","BASHIR: Acknowledged, Commander. I still have that champagne on ice. ",403
"Replimat","(Nog leaves his bugs by a couple and runs away to watch. The couple start scratching, then their skin changes colour to blue and green.)",403
"Replimat","WOMAN: Help us!",403
"Replimat","MAN: Somebody help us!",403
"Replimat","WOMAN: Something is happening to us!",403
"Replimat","MAN: Get a doctor!",403
"Replimat","(Then suddenly it's all over and they're fine again. Jake and Nog are lead away by a Deputy. Keiko watches thoughtfully.) ",403
"Holosuite","(The programme is finished and Iduban is lying on the floor)",403
"Holosuite","ODO: The door opened only twice. The first time when the computer logged Ibudan's check-in at seventeen hundred hours, sixteen minutes. The suite was secured so no one else could enter. He ran Lauriento massage holoprogram number one oh one A. Thirteen minutes later the door opened for the second time, but since Ibudan obviously didn't exit, we have to assume that's when the killer left.",403
"Holosuite","KIRA: Any evidence of a beam in during those thirteen minutes?",403
"Holosuite","ODO: No.",403
"Holosuite","KIRA: Well then how did the killer get in?",403
"Holosuite","SISKO: He might have entered the holosuite the same time Ibudan did.",403
"Holosuite","BASHIR: Cause of death's no mystery. The knife was thrust directly between the left and right thoracic vertebrae, perforating the lower ventricle of the heart. The murderer apparently had a decent knowledge of Bajoran anatomy.",403
"Holosuite","SISKO: Doctor, I want you to look for evidence that could establish someone was in here with him.",403
"Holosuite","BASHIR: I'll do a sweep for hair follicles, any skin or cellular remnants, and DNA fragments.",403
"Holosuite","SISKO: How many ships have left since yesterday.",403
"Holosuite","KIRA: Two. A Federation survey ship and a Vulcan science vessel.",403
"Holosuite","SISKO: Advise all ships in dock that departures will be delayed until further notice. ",403
"O'Brien's quarters","(At their evening meal, Japanese-style.)",403
"O'Brien's quarters","KEIKO: And they were just looking for trouble. Those kids have no reason to be hanging around the Promenade.",403
"O'Brien's quarters","O'BRIEN: It's about the only place they have to go. You can't keep them locked in their rooms.",403
"O'Brien's quarters","KEIKO: This isn't like a starship, Miles. The kind of freedom children have on the Enterprise just won't work on a space station. There are too many ways to get into serious trouble here. What this place needs is a school. ",403
"Commander's office","KIRA: All ships have been informed of the delays, Commander.",403
"Commander's office","SISKO: Major, do you know Mister Zayra, who operates the Transit Aid centre?",403
"Commander's office","KIRA: We've met.",403
"Commander's office","SISKO: He was just telling me something disturbing. I think you should hear it",403
"Commander's office","ZAYRA: It's just that the murdered man, Ibudan, I spoke to him yesterday about an hour before it happened.",403
"Commander's office","KIRA: Where was this?",403
"Commander's office","ZAYRA: Quark's. By the dabo table. It was after his scuffle with the shape-shifter. He told me that he was scared. He was afraid that Odo might kill him.",403
"Commander's office","KIRA: There isn't a more honourable man on this station than the Constable.",403
"Commander's office","ZAYRA: Maybe so. All I know is, an hour later, Ibudan was dead. ",403
"Ibudan's quarters","(On board a Bajoran ship docked at DS9.)",403
"Ibudan's quarters","OFFICER: Computer, lights. This was Ibudan's quarters. Feel free to look around.",403
"Ibudan's quarters","ODO: Double accommodations?",403
"Ibudan's quarters","OFFICER: That's what he requested, but only one passenger was logged in. He probably just wanted larger quarters. If there's anything else you need.",403
"Ibudan's quarters","ODO: I want a record of all the passengers on board.",403
"Ibudan's quarters","OFFICER: Of course. I'll get you a copy of the ship's manifest.",403
"Ibudan's quarters","(The officer leaves)",403
"Ibudan's quarters","ODO: Computer, how many entries made from this terminal during the last seventy eight hours.",403
"Ibudan's quarters","COMPUTER: Seven entries noted in personal calendar files.",403
"Ibudan's quarters","ODO: Show them to me.",403
"Ibudan's quarters","(Stardate 46383 Secure for departure, Depart from",403
"Ibudan's quarters","Alderaan spaceport, Lifeboat drill, Lunch meeting with",403
"Ibudan's quarters","Della Santina, Tennis holodeck 2, Dinner, Ship's concert.) ODO: Take me to stardate 46384",403
"Ibudan's quarters","(Subspace conference - Gocke, Meeting with Zarro - project analysis, Lunch with Moudakis, Tennis holodeck 3, Arrival DS9, Disembark, Shopping at Promenade, Tennis holodeck 2, Meeting with Ahern, Lunch at Quark's Place, Transit Aid, Back up computer files, Prepare project review report, Odo.) ",403
"Sisko's quarters","SISKO: You won't get an argument from me, Mrs O'Brien. When I found out what happened this morning on the Promenade",403
"Sisko's quarters","JAKE: We weren't doing anything.",403
"Sisko's quarters","SISKO: I don't want to talk about this now. It's this Ferengi boy, Nog. Jake's won't be having anything more to do with him.",403
"Sisko's quarters","JAKE: He's the only one here even close to my age.",403
"Sisko's quarters","KEIKO: That's not exactly true, Jake. There are twelve other children on board, ranging from eight to sixteen. The problem is there's no structured activity for them. Don't you miss the schools you used to go to, Jake?",403
"Sisko's quarters","JAKE: No. I guess. Studying alone on the computer, it kind of gets boring sometimes.",403
"Sisko's quarters","KEIKO: You know, I've never actually been a teacher, Commander, but it's something I've always thought about doing.",403
"Sisko's quarters","SISKO: As a Starfleet Commander and as a father, I think this is a terrific idea. What do you need?",403
"Sisko's quarters","KEIKO: Some space.",403
"Sisko's quarters","SISKO: We'll find it.",403
"Sisko's quarters","KEIKO: Computers?",403
"Sisko's quarters","SISKO: You'll have them. I hope you realise what you're getting yourself into. I can't force the Bajora, the Ferengi or anyone else to send their children to your school. And even if they do come, every one has a different culture, a different philosophy.",403
"Sisko's quarters","KEIKO: I know I'll have to come up with an innovative programme But I can't imagine any parent not welcoming the news of a school opening here. Thank you, Commander.",403
"Sisko's quarters","(Keiko leaves)",403
"Sisko's quarters","SISKO: If I hear of you hanging around with him.",403
"Sisko's quarters","JAKE: I thought you didn't want to talk about this now. ",403
"Infirmary","BASHIR: These are the DNA sequence analyses, the cellular spectrographs and the particulate matter traces. I asked Lieutenant Dax to confirm my findings and I'm afraid she concurs.",403
"Infirmary","DAX: There were no new DNA traces found in the holosuite.",403
"Infirmary","KIRA: You're saying nobody went into the room with him?",403
"Infirmary","BASHIR: Well, apart from those of us who were in there after the body was discovered, this was the only DNA present, and we've identified it as Ibudan's.",403
"Infirmary","KIRA: Wait a minute. Ibudan goes in the holosuite alone, locks the door, nobody transports in, a few minutes later he's murdered. How is that possible?",403
"Infirmary","ODO: It's not. Unless the murder was committed by someone who could get through the cracks in the door. Say, a shape-shifter. ",403
"Ops","ODO: It's a pretty neat package. His calendar shows he was planning to meet with me at the time of the murder. No one except a shape-shifter could get into the holosuite. And since I'd obviously be called there after the body was discovered, traces of my DNA wind up at the scene of the crime.",403
"Ops","KIRA: Do you have any kind of an alibi?",403
"Ops","ODO: Major, I have to return to my natural state every eighteen hours to regenerate. To be quite honest about it, I was in a pail in the back of my office when Ibudan was killed.",403
"Ops","KIRA: The killer might have known your regenerative cycle and planned the murder accordingly.",403
"Ops","ODO: Like I said, a neat package.",403
"Ops","KIRA: Who might want to frame you for murder?",403
"Ops","ODO: I can think of about five hundred different people, but I haven't seen any of them around the station recently. Do you think that Federation doctor could do a sweep of Ibudan's quarters for me, see if he can find out if somebody else was using that second bed?",403
"Ops","KIRA: I'll send him over there right away.",403
"Ops","ODO: Thank you, Major. ",403
"Quark's","GIRL: Dabo!",403
"Quark's","ROM: You want my boy to go to a Federation school?",403
"Quark's","KEIKO: Not just Federation. I'm developing a curriculum that will take a much broader approach.",403
"Quark's","ROM: Little lady, little lady, what do you know of Ferengi education?",403
"Quark's","KEIKO: I understand you employ a work-study approach, Mister Rom, with apprenticeships in a wide range of business and economic fields.",403
"Quark's","ROM: We throw them into the cut-throat competition of Ferengi commerce and anyone who survives, graduates. Are you prepared to teach that to my son?",403
"Quark's","KEIKO: I'm sure I couldn't improve on what you've already taught him in that department.",403
"Quark's","ROM: Thank you. Thank you. I've taught him everything I know. It's so important that we prepare our youth for the challenges of the future.",403
"Quark's","KEIKO: Exactly. Consider the advantage your son will have over other Ferengi once he's learned about other cultures, once he learns how others run their economies, conduct business, negotiate.",403
"Quark's","ROM: You will teach my son these things?",403
"Quark's","KEIKO: Knowledge is power, Mister Rom.",403
"Quark's","ROM: It can't work. He will not listen to you.",403
"Quark's","KEIKO: Why not?",403
"Quark's","ROM: You are female.",403
"Quark's","KEIKO: So?",403
"Quark's","ROM: My son cannot learn anything from a female human teacher.",403
"Quark's","KEIKO: Let him try it for a few weeks. He has nothing to lose and so much to gain.",403
"Quark's","ROM: I don't think so.",403
"Quark's","KEIKO: Will you at least think about it?",403
"Quark's","ROM: Yes. Yes. Of course. Now, really, I'm quite busy. Place your wagers! Place your wagers. Get this lovely young woman a drink.",403
"Quark's","(Keiko leaves, and as we follow her past the bar)",403
"Quark's","ZAYRA: What do we know about him anyway? He's not one of us.",403
"Quark's","BAJORAN: He isn't one of anything.",403
"Quark's","ZAYRA: You know what really bothers me? This shifter was the last Chief of Security when the Cardassians were here.",403
"Quark's","BAJORAN: He's the one who caught Ibudan for them.",403
"Quark's","ZAYRA: Why is he still Security Chief?",403
"Quark's","BAJORAN: You're right. We ought to talk to Major Kira.",403
"Quark's","QUARK: Nobody knows him like I know him. Let me tell you something. He's an ill-tempered, over-bearing crosspatch. But he was no Cardassian collaborator and he's no killer.",403
"Quark's","ZAYRA: I can't believe you're defending him, Quark. You're his worst enemy.",403
"Quark's","QUARK: Guess that's the closest thing he has in this world to a friend.",403
"Quark's","(A grey-bearded Bajoran in a cloak and hood watches the men talking.",403
"Quark's","ZAYRA: Security, huh? ",403
"Ibudan's quarters","(Bashir is vacuuming up samples of debris in the room) ",403
"Ops","SISKO: Listen, I hear what you're saying. I understand your concerns.",403
"Ops","ZAYRA: We're not saying whether he's innocent or guilty, Commander. All we're saying is isn't it reasonable under the circumstances that he",403
"Ops","KIRA: Thank you very much for coming.",403
"Ops","(Zayra and the deputation leave.)",403
"Ops","KIRA: This is wrong.",403
"Ops","SISKO: And what would you suggest we do?",403
"Ops","KIRA: He didn't do it.",403
"Ops","SISKO: The man we have in charge of a murder investigation is the prime suspect, Major. Those people have a right to complain.",403
"Ops","DAX: Even if he's innocent, it could still seem like a conflict of interest, Kira.",403
"Ops","KIRA: You're going to relieve him of duty.",403
"Ops","SISKO: I don't see any other choice.",403
"Ops","KIRA: He has been completely candid about this investigation. He could have covered his tracks a half a dozen times already if he were guilty.",403
"Ops","SISKO: I appreciate how you feel, but the decision stands. I'll inform him myself. ",403
"Infirmary","BASHIR: The only curious thing I found were these seofurane fragments near the matter reclamation unit. Dish, please. It appears he was trying to get rid of them.",403
"Infirmary","ODO: Do you have any idea what they're from?",403
"Infirmary","BASHIR: I know exactly what they're from. A biological sample container. I use them all the time.",403
"Infirmary","ODO: What would Ibudan be doing with a biological sample container?",403
"Infirmary","BASHIR: That I'm not so sure about, but when I analysed the fragments I detected traces of a complex organic structure.",403
"Infirmary","ODO: Translate, Doctor.",403
"Infirmary","BASHIR: It suggests Ibudan may have been conducting some sort of medical experiment on board his ship.",403
"Infirmary","ODO: He wasn't a doctor or a scientist.",403
"Infirmary","BASHIR: Let's see what a standard electrophoretic analysis tells us.",403
"Infirmary","(Bashir touches a few buttons and looks at the monitor)",403
"Infirmary","BASHIR: What the? The complex proteins are breaking down into DNA fragments.",403
"Infirmary","ODO: And what does that mean?",403
"Infirmary","BASHIR: It means we should set up a bio-regenerative field to accelerate the cellular development. If I can reconstruct the DNA sequence, it might just give us an idea what he was up to.",403
"Infirmary","SISKO [OC]: Sisko to Odo.",403
"Infirmary","ODO: Here.",403
"Infirmary","SISKO [OC]: May I see you in my office, please.",403
"Infirmary","ODO: Acknowledged.",403
"Infirmary","(Bashir puts his sample into a large vat) ",403
"Commander's office","ODO: Commander?",403
"Commander's office","SISKO: Sit down. I am temporarily relieving you of duty. I'm sure the reasons are obvious.",403
"Commander's office","ODO: Who will be taking over the investigation?",403
"Commander's office","SISKO: I've placed Major Kira and Lieutenant Dax in charge.",403
"Commander's office","ODO: Will that be all, Commander?",403
