"scenename","scenecontent","ep_number"
"Saratoga - Bridge","LOCUTUS [on viewscreen]: Resistance is futile. You will disarm your weapons and escort us to sector zero zero one. If you attempt to intervene, we will destroy you.",401
"Saratoga - Bridge","CAPTAIN: (a Vulcan) Red alert. Load all torpedo bays. Ready phasers. Move us to position alpha, Ensign.",401
"Saratoga - Bridge","(The space battle begins)",401
"Saratoga - Bridge","OPS OFFICER: (woman) They've locked on.",401
"Saratoga - Bridge","SISKO: Reroute auxiliary power.",401
"Saratoga - Bridge","OPS OFFICER: Our shields are being drained. Sixty four percent. Forty two.",401
"Saratoga - Bridge","CAPTAIN: Recalibrate shield nutation.",401
"Saratoga - Bridge","TACTICAL: (Bolian) Modulation is having no effect.",401
"Saratoga - Bridge","OPS OFFICER: Shields have failed.",401
"Saratoga - Bridge","SISKO: Full reverse.",401
"Saratoga - Bridge","CAPTAIN: Maintain all Argh!",401
"Saratoga - Bridge","(Everything goes BOOM)",401
"Saratoga - Bridge","SISKO: Damage report. Damage report!",401
"Saratoga - Bridge","COMPUTER: Warning. Damage to warp core. Containment failure in five minutes.",401
"Saratoga - Bridge","TACTICAL: Direct hit decks one through four.  SISKO: Let's get the civilians to the escape pods, Lieutenant.",401
"Saratoga - Bridge","TACTICAL: Aye, sir. ",401
"Corridor","SISKO: Leave everything. Get to your assigned evacuation area now.",401
"Corridor","COMPUTER: Warning. Damage to warp core. Containment failure in four minutes.",401
"Corridor","(They come to a woman)",401
"Corridor","SISKO: Doran.",401
"Corridor","TACTICAL: I'll take care of her. You go on.",401
"Corridor","SISKO: Have you seen Jennifer? ",401
"Sisko's quarters","(The room is on fire and Sisko's wife and son are trapped beneath girders and debris)",401
"Sisko's quarters","SISKO: Jennifer? Jake!",401
"Sisko's quarters","COMPUTER: Warning. Damage to warp core. Containment failure in three minutes.",401
"Sisko's quarters","(Sisko starts throwing debris away and pulls the boy out.)",401
"Sisko's quarters","SISKO: I'm going to get your mom. You're going to be okay.",401
"Sisko's quarters","(More debris shifting)",401
"Sisko's quarters","SISKO: Jennifer. Okay, Jake, we'll get your mom out and we'll get out of here.",401
"Sisko's quarters","TACTICAL: Commander!",401
"Sisko's quarters","SISKO: Help me. Jennifer, hold on.",401
"Sisko's quarters","TACTICAL: (scanning her) Sir.",401
"Sisko's quarters","SISKO: Just help me to get her free.",401
"Sisko's quarters","TACTICAL: She's gone. There's nothing we can do. We have to leave.",401
"Sisko's quarters","COMPUTER: Warning. Damage to warp core. Containment failure in two minutes.",401
"Sisko's quarters","TACTICAL: Ensign, take the boy.",401
"Sisko's quarters","ENSIGN: Aye, sir.",401
"Sisko's quarters","TACTICAL: We've got to go now, sir.",401
"Sisko's quarters","SISKO: Damn it, we just can't leave her here.",401
"Sisko's quarters","(The Bolian hauls the protesting Sisko out of the room) ",401
"Runabout","SISKO: Jake. Jake, you're okay.",401
"Runabout","CREWMAN: Stand by to launch.",401
"Runabout","CREWWOMAN: Ready.",401
"Runabout","(And the Saratoga goes KaBOOM) ",401
"Runabout"," Stardate 46379.1. Three years later. ",401
"Fishing pond","(The gangly youth is fishing off a covered bridge)",401
"Fishing pond","SISKO: Jake, there you are. How are they biting?",401
"Fishing pond","JAKE: Small fries. Threw them back. Want to go for a swim?",401
"Fishing pond","SISKO: Don't have time. We have to get ready. It won't be so bad. I've heard that Bajor is a beautiful world.",401
"Fishing pond","JAKE: So why can't we live on the planet instead of some old space station?",401
"Fishing pond","SISKO: The station is in orbit of Bajor. It'll be just like shore duty.",401
"Fishing pond","JAKE: Will there be kids there?",401
"Fishing pond","SISKO: Absolutely. Lots of kids.",401
"Fishing pond","CAPTAIN [OC]: Bridge to Sisko.",401
"Fishing pond","SISKO: Yes, Captain.",401
"Fishing pond","CAPTAIN [OC]: We're approaching Deep Space Nine, Commander. We'll be docking in seven minutes.",401
"Fishing pond","SISKO: Acknowledged. Come on. What do you say? We'll take the pond with us. Computer, end programme. ",401
"Corridor","JAKE: Is that it?",401
"Corridor","(Through a viewing window we see a circular space station with three curved vertical spines above and below. Oh, you know what it looks like.) ",401
"Corridor","Commence station log, Deep Space Nine, Commander Benjamin Sisko, Stardate 46388.2. At the request of the Bajoran provisional government, Starfleet has agreed to establish a Federation presence in this system following the withdrawal of Cardassian occupational forces. The first contingent of officers, including my Chief of Operations, Miles O'Brien, arrived two days ago on the Enterprise. ",401
"Promenade","(The place looks like it's been in the middle of a war zone. O'Brien is in black overalls with coloured shoulders whilst Sisko is in the TNG style uniform still.)",401
"Promenade","O'BRIEN: I'm told the Cardassians decided to have some fun the day they left. Four Bajorans were killed trying to protect their shops.",401
"Promenade","SISKO: Why hasn't anybody cleaned this up?",401
"Promenade","O'BRIEN: We've got all available personnel assigned to repairing primary systems, sir. The Cardassians took every component of value. We're virtually defenceless. I discussed this with Major Kira, the attachÃ© assigned here by the Bajoran government and we decided",401
"Promenade","SISKO: Understood. What about the civilians who operated these shops?",401
"Promenade","O'BRIEN: A lot of them lost everything they had. A few are trying to rebuild, but most are packing up to leave. ",401
"Shrine entrance","MONK: Welcome, Commander. Please enter. The prophets await you.",401
"Shrine entrance","SISKO: Another time, perhaps.",401
"Shrine entrance","MONK: Another time. ",401
"Sisko's quarters","O'BRIEN: When my wife Keiko saw our quarters, she started talking about visiting her mother in Kumamoto. Sir, I wouldn't allow the boy to go roaming. We're still having some security problems.",401
"Sisko's quarters","JAKE: Dad, there is nothing to sleep on in there except a cushion on the floor.",401
"Sisko's quarters","O'BRIEN: We can get you a real bunk off the Enterprise. I almost forgot. Captain Picard wants to see you as soon as possible.",401
"Sisko's quarters","SISKO: He does. Any word on our science and medical officers yet?",401
"Sisko's quarters","O'BRIEN: They're expected tomorrow.",401
"Sisko's quarters","SISKO: Jake, I want you to stay here until I come back.",401
"Sisko's quarters","JAKE: Is this the food replicator?",401
"Sisko's quarters","O'BRIEN: I'm afraid they're all offline. There's plenty of emergency rations. I could send some down.",401
"Sisko's quarters","JAKE: Dad?",401
"Sisko's quarters","SISKO: We're going have to rough it til we get things up and running, Jake, okay?",401
"Sisko's quarters","JAKE: Okay.",401
"Sisko's quarters","SISKO: Okay. ",401
"Ops","(repairs going on here too)",401
"Ops","O'BRIEN: I'd like to ask the designer what he was thinking about when they built this place. I still haven't been able to find an ODN access. that's the Prefect's office up there.",401
"Ops","(the office is up some steps, with a view out over the whole of Ops)",401
"Ops","SISKO: So all others have to look up with respect. Cardassian architecture.",401
"Ops","O'BRIEN: Yes, sir. Major Kira's been using it.",401
"Ops","SISKO: Is it my imagination or is it unusually warm?",401
"Ops","O'BRIEN: The environmental controls in Ops are stuck at thirty-two C. We're working on it.",401
"Ops","(Raised voices can be heard coming from the office)",401
"Ops","SISKO: I guess it's time to meet Major Kira.",401
"Ops","O'BRIEN: Sir, have you ever served with any Bajoran women?",401
"Ops","SISKO: No. Why?",401
"Ops","O'BRIEN: I was just wondering, sir.",401
"Ops","KIRA [OC]: They've become meaningless.",401
"Ops","BUREAUCRAT [OC]: I just don't agree, Kira. ",401
"Commander's office","(The Major is a fiery red-head in a rust coloured uniform)",401
"Commander's office","KIRA: You are throwing it all away! All of you!",401
"Commander's office","BUREAUCRAT [on monitor]: You're being a fool!",401
"Commander's office","KIRA: Well then, don't ask my opinion next time!",401
"Commander's office","(turns off the monitor)",401
"Commander's office","KIRA: Yes?",401
"Commander's office","SISKO: I'm Benjamin Sisko.",401
"Commander's office","KIRA: I suppose you want the office.",401
"Commander's office","SISKO: Well, I thought I'd say hello first and then take the office, but we could do it in any order you'd like.",401
"Commander's office","KIRA: Hello.",401
"Commander's office","SISKO: Is something bothering you, Major?",401
"Commander's office","KIRA: You don't want to ask me that, Commander.",401
"Commander's office","SISKO: Why not?",401
"Commander's office","KIRA: Because I have the bad habit of telling the truth even when people don't want to hear it.",401
"Commander's office","SISKO: Perhaps I want to hear it.",401
"Commander's office","KIRA: I don't believe the Federation has any business being here.",401
"Commander's office","SISKO: The provisional government disagrees with you.",401
"Commander's office","KIRA: The provisional government and I don't agree on a lot of things which is probably why they've sent me to this god-forsaken place. I have been fighting for Bajoran independence since I was old enough to pick up a phaser. We finally drive the Cardassians out and what do our new leaders do? They call up the Federation and invite them right in.",401
"Commander's office","SISKO: The Federation is only here to help",401
"Commander's office","KIRA: Help us. Yes, I know. The Cardassians said the same thing sixty years ago.",401
"Commander's office","SISKO: Major, when I was ordered here, I requested a Bajoran national as my first officer. It made sense. It still does, at least to me. Now, you and I are going to have to",401
"Commander's office","(Beep)",401
"Commander's office","ODO [OC]: (mostly human but a very bland face) Yes, Major?",401
"Commander's office","KIRA: Odo, are you reading something at A-fourteen?",401
"Commander's office","ODO [on monitor]: My security array has been down for two hours. I'll meet you there.",401
"Commander's office","KIRA: We've been having a lot of break-ins lately. No need for you to come along, Commander.",401
"Commander's office","(So he follows her) ",401
"Assaying office","(Bajoran security (in grey) are coming down the stairs)  NOG: (a young Ferengi) Hurry up! Now.",401
"Assaying office","(The alien ransacking the shelves keeps going.)",401
"Assaying office","NOG: Now!",401
"Assaying office","(They leave through a broken piece of metal mesh onto the chaotic Promenade) ",401
"Promenade","ODO: All right, just stand where you are.",401
"Promenade","KIRA: Hold it!",401
"Promenade","(The alien throws a morning-star at Odo, who morphs his head so it goes straight through and sticks in the bulkhead behind him. The alien then tries to run, Odo grabs him and Sisko fires his phaser.)",401
"Promenade","SISKO: That's enough!",401
"Promenade","ODO: Who the hell are you?",401
"Promenade","KIRA: Odo, this is our new Starfleet Commander.",401
"Promenade","ODO: I don't allow weapons on the Promenade. That includes phasers. (The next actor played Trek's very first Ferengi - Armin Shimerman is back!)",401
"Promenade","QUARK: (a Ferengi) Nog? What's going on?",401
"Promenade","ODO: The boy's in a lot of trouble.",401
"Promenade","QUARK: Commander, my name is Quark. I used to run the local gambling establishment. This is my brother's boy. Surely you can see that he only has a peripheral involvement in all this. We're scheduled to depart tomorrow. If we could be permitted to take him, I promise you he will be severely",401
"Promenade","SISKO: That won't be possible. Take him to the brig.",401
"Promenade","(Nog is taken away and Quark goes back into the bar)",401
"Promenade","KIRA: Quark probably sent the two of them here to steal the ore samples in the first place.",401
"Promenade","SISKO: Major, there's a Ferengi legal tradition. It's called plea bargaining. I might let the boy go, but I want something in exchange from Mister Quark. Something very important.",401
"Promenade","O'BRIEN [OC]: O'Brien to Commander Sisko.",401
"Promenade","SISKO: Go ahead.",401
"Promenade","O'BRIEN [OC]: Sir, the Enterprise hailed us again. Captain Picard is waiting to see you.",401
"Promenade","SISKO: Acknowledged. This won't take long. ",401
"Observation lounge","PICARD: Come.",401
"Observation lounge","(Sisko enters)",401
"Observation lounge","PICARD: Commander. Yes, please, come in. Welcome to Bajor.",401
"Observation lounge","SISKO: It's been a long time, Captain.",401
"Observation lounge","PICARD: Have we met before?",401
"Observation lounge","SISKO: Yes, sir. We met in battle. I was on the Saratoga at Wolf 359.",401
"Observation lounge","(Oh dear, he's still carrying a grudge. Big pause.)",401
"Observation lounge","PICARD: I assume that you have been briefed on the events leading to the Cardassian withdrawal?",401
"Observation lounge","SISKO: Yes, sir. I understand they've spent the last half century robbing the planet of every valuable resource before abandoning it.",401
"Observation lounge","PICARD: They've left the Bajorans without a means of being self-sustaining. The relief efforts we've been coordinating are barely adequate. I've come to know the Bajorans. I'm a strong proponents for their entry into the Federation.",401
"Observation lounge","SISKO: Is it going to happen?",401
"Observation lounge","PICARD: Not easily. The ruling parties are at each others throats. Factions that were united against the Cardassians have resumed old conflicts.",401
"Observation lounge","SISKO: Sounds like they're not ready.",401
"Observation lounge","PICARD: Your job is to do everything short of violating the Prime Directive to make sure that they are. I have been made aware by Starfleet of your objections to this assignment. I would have thought that after three years spent at the Utopia Planitia yards, that you would be ready for a change.",401
"Observation lounge","SISKO: I have a son that I'm raising alone, Captain. This is not the ideal environment.",401
"Observation lounge","PICARD: Unfortunately as Starfleet officers, we do not always have the luxury to serve in an ideal environment.",401
"Observation lounge","SISKO: I realise that, sir, and I'm investigating the possibility of returning to Earth for civilian service.",401
"Observation lounge","PICARD: Perhaps Starfleet Command should be considering a replacement for you.",401
"Observation lounge","SISKO: That's probably a good idea.",401
"Observation lounge","PICARD: I'll look into it. In the meantime however SISKO: In the meantime, I will do the job I've been ordered to do to the best of my ability, sir.",401
"Observation lounge","PICARD: Dismissed. ",401
"Security office","(the main desk looks out through glass doors straight onto the Promenade)",401
"Security office","SISKO: It's really quite simple, Quark. You're not going to leave.",401
"Security office","QUARK: Not going to leave? But we're packed and ready to go.",401
"Security office","SISKO: Unpack.",401
"Security office","QUARK: I don't understand, Commander. Why would you want me to stay?",401
"Security office","ODO: I'm curious myself. The man is a gambler and a thief.",401
"Security office","QUARK: I'm not a thief.",401
"Security office","ODO: You are a thief.",401
"Security office","QUARK: If I am, you haven't been able to prove it for four years.",401
"Security office","SISKO: Please. My officers, the Bajoran engineers, all their families depend on the shops and services of this Promenade. If people like you abandon it, this is going to become a ghost town. We need someone to step forward and say, I'm staying, I'm rebuilding. We need a community leader and it's going to be you, Quark.",401
"Security office","QUARK: Community leader?",401
"Security office","ODO: Seems reasonable. You have all the character references of a politician.",401
"Security office","QUARK: How could I possibly operate my establishment under Starfleet rules of conduct?",401
"Security office","SISKO: This is still a Bajoran station. We're just here to administrate. You run honest games, you won't have any problems from me.",401
"Security office","QUARK: Commander, I've made a career out of knowing when to leave, and this Bajoran provisional government is far too provisional for my taste. And when governments fall, people like me are lined up and shot.",401
"Security office","SISKO: There is that risk but then, you are a gambler, Quark.",401
"Security office","ODO: And a thief.",401
"Security office","SISKO: You know, Quark, that poor kid is about to spend the best years of his life in a Bajoran prison. I'm a father myself. I know what your brother must be going through. The boy should be with his family, not in some cold jail cell. Think about it. It's up to you.",401
"Security office","(Sisko leaves)",401
"Security office","ODO: You know, at first, I didn't think I was going to like him. ",401
"Promenade","(Kira is across the way in her 'shirt sleeves', hefting debris into a skip.)",401
"Promenade","SISKO: Major? KIRA: Everyone else is busy repairing the primary systems. I suppose Starfleet officers aren't used to getting their hands dirty.",401
"Promenade","(So Sisko moves rubbish too)",401
"Promenade","KIRA: In the refugee camps, we learned to do whatever needed to be done. Didn't matter who you were.",401
"Promenade","SISKO: I was just talking with our good neighbour, Quark. Te's laying odds that the government's going to fall.",401
"Promenade","KIRA: Quark knows a good bet when he hears one. This government will be gone in a week and so will you.",401
"Promenade","SISKO: What happens to Bajor then?",401
"Promenade","KIRA: Civil war.",401
"Promenade","SISKO: You think it's inevitable?",401
"Promenade","KIRA: The only one who can prevent it is Opaka.",401
"Promenade","SISKO: Opaka?",401
"Promenade","KIRA: Our spiritual leader. She's known as the Kai. Our religion is the only thing that holds my people together. If she would call for unity, they'd listen. Leaders of all the factions have tried to get to her, but she lives in seclusion, rarely sees anyone.",401
"Promenade","MONK: Commander. It is time. ",401
"Bajor Monastery","(Down on the planet, the sacred place is a site of desecration, with chanting in the background. Sisko is met in a colonnade by a short, stout, brisk woman. )",401
"Bajor Monastery","OPAKA: I apologise for the condition in which we greet you.",401
"Bajor Monastery","SISKO: The Cardassians?",401
"Bajor Monastery","(they sit by a pool)",401
"Bajor Monastery","OPAKA: Your arrival has been greatly anticipated.",401
"Bajor Monastery","(She caresses his left ear.)",401
"Bajor Monastery","OPAKA: Have you ever explored your pagh, Commander?",401
"Bajor Monastery","SISKO: Pagh?",401
"Bajor Monastery","OPAKA: A Bajoran draws courage from his spiritual life. Our life-force, our pagh, is replenished by the Prophets.",401
"Bajor Monastery","(She squeezes the lobe.)",401
"Bajor Monastery","OPAKA: Breathe.",401
"Bajor Monastery","SISKO: Kai Opaka, if we could discuss",401
"Bajor Monastery","OPAKA: Breathe! Ironic. One who does not wish to be among us is to be the Emissary. Please, come with me.",401
"Bajor Monastery","(She touches a control and the pool reveals itself to be a hologram hiding a staircase downwards) ",401
"Secret cavern","OPAKA: You are correct that Bajor is in grave jeopardy, but it is the threat to our spiritual life that far outweighs any other.",401
"Secret cavern","SISKO: Perhaps, but I'm powerless until",401
"Secret cavern","OPAKA: Commander. I cannot give you what you deny yourself.",401
"Secret cavern","SISKO: I'm sorry?",401
"Secret cavern","OPAKA: Look for solutions from within, Commander. Come with me.",401
"Secret cavern","(She opens a case to reveal a floating, green glowing bolus - an Orb)",401
"Secret cavern","SISKO: What is it?",401
"Secret cavern","OPAKA: The Tear of the Prophet. ",401
"Vision - Beach","SISKO: What the hell? Opaka?",401
"Vision - Beach","(He's holding a tray of drinks and the sand is very hot. He hops and runs to the nearest towel, kicking sand onto a young woman.)",401
"Vision - Beach","JENNIFER: Hey!",401
"Vision - Beach","SISKO: I'm sorry. it's just that this. Jen?",401
"Vision - Beach","JENNIFER: Yes?",401
"Vision - Beach","SISKO: Jennifer?",401
"Vision - Beach","JENNIFER: I'm sorry did we meet last night at George's party?",401
"Vision - Beach","SISKO: George? Jennifer. Wait a minute. This is impossible.",401
"Vision - Beach","JENNIFER: Are you okay?",401
"Vision - Beach","SISKO: I know this place. This is Gilgo beach, where we met.",401
"Vision - Beach","JENNIFER: We met here before?",401
"Vision - Beach","SISKO: I was carrying three lemonades. The sand was burning my feet, and I stopped here to. Ow! Do you realise how incredible this is? No, of course you don't. I. Jennifer, have a lemonade.",401
"Vision - Beach","JENNIFER: I'm afraid I don't accept drinks from strange men on the beach.",401
"Vision - Beach","(He leaves the drinks and follows her along the beach.)",401
"Vision - Beach","JENNIFER: So tell me the truth. Have we really meet before?",401
"Vision - Beach","SISKO: No.",401
"Vision - Beach","JENNIFER: Then how did you know my name?",401
"Vision - Beach","SISKO: I, er, George told me, at the party.",401
"Vision - Beach","JENNIFER: Are you going to tell me your name?",401
"Vision - Beach","SISKO: Oh. Ben Sisko. I just graduated from Starfleet Academy. I'm waiting for my first posting.",401
"Vision - Beach","JENNIFER: Ah, a junior officer.",401
"Vision - Beach","SISKO: Yeah.",401
"Vision - Beach","JENNIFER: My mother warned me to watch out for junior officers.",401
"Vision - Beach","SISKO: Your mother is going to adore me.",401
"Vision - Beach","JENNIFER: You're awfully sure of yourself.",401
"Vision - Beach","SISKO: It's not every day you meet the girl you're going to marry.",401
"Vision - Beach","JENNIFER: Do you use this routine a lot with women?",401
"Vision - Beach","SISKO: No. Never before and never again.",401
"Vision - Beach","JENNIFER: Sure.",401
"Vision - Beach","SISKO: How about letting me cook dinner for you tonight. My father was a gourmet chef. I will make for you his famous aubergine stew.",401
"Vision - Beach","JENNIFER: I don't know.",401
"Vision - Beach","SISKO: You're supposed to say, yes!",401
"Vision - Beach","JENNIFER: I'll probably be sorry.",401
"Vision - Beach","(The orb appears)",401
"Vision - Beach","SISKO: Jennifer! ",401
"Secret cavern","(Opaka closes the Orb case.)",401
"Secret cavern","OPAKA: Nine Orbs, like this one, have appeared in the skies over the past ten thousand years. The Cardassians took the others. You must find the Celestial Temple before they do.",401
"Secret cavern","SISKO: The Celestial Temple?",401
"Secret cavern","OPAKA: Tradition says the orbs were sent by the Prophets to teach us. What we have learned has shaped our theology. The Cardassians will do anything to decipher their powers. If they discover the Celestial Temple, they could destroy it.  SISKO: What makes you think I can find your Temple?",401
"Secret cavern","(Opaka hands him the Orb box.)",401
"Secret cavern","OPAKA: This will help you.",401
"Secret cavern","SISKO: Kai Opaka.",401
"Secret cavern","OPAKA: I can't unite my people till I know the Prophets have been warned. You will find the Temple. Not for Bajor, not for the Federation, but for your own pagh. It is, quite simply, Commander, the journey you have always been destined to take. ",401
"Jake's room","(Jake is sleeping on the floor and wearing a baseball glove when Sisko goes in to put a blanket on him)",401
"Jake's room","JAKE: What?",401
"Jake's room","SISKO: I was just thinking how much you look like your mom.",401
"Jake's room","KIRA [OC]: Kira to Sisko.",401
"Jake's room","SISKO: Go ahead.",401
"Jake's room","KIRA [OC]: Sorry to disturb you, Commander, but there's something on the Promenade you might want to see.",401
"Jake's room","SISKO: On my way. ",401
"Promenade","(There's laughter and voices coming from a lit-up area) ",401
"Quark's","(Customers are happy, drinking, talking, an alien is playing music on a pile of stones, and there is a gaming wheel.)",401
"Quark's","PIT BOSS: Step up, step up. Fortune's fates are with you today, friends.",401
"Quark's","GIRL: Dabo!",401
"Quark's","ALIEN: (female) That's fine. I'll be right back.",401
"Quark's","GIRL: Dabo!",401
"Quark's","(Quark is behind his bar)",401
"Quark's","QUARK: What'll you have, Commander? SISKO: How's the local synthale?",401
"Quark's","QUARK: You won't like it. I love the Bajorans. Such a deeply spiritual culture, but they make a dreadful ale. Never trust ale from a god-fearing people, or a Starfleet Commander that has one of your relatives in jail.",401
"Quark's","GIRL [OC]: Dabo! ",401
"Quark's","Station log. Stardate 46390.1. The Enterprise has been ordered to the Lapolis system. They're scheduled to depart at zero-five hundred hours after offloading three runabout class vessels. Meanwhile, our medical and science officers are arriving, and I'm looking forward to a reunion with a very old friend. ",401
"Promenade","(Exiting the airlock)",401
"Promenade","KIRA: Commander, if you'd like me to give them a tour of the station.",401
"Promenade","SISKO: You and Doctor Bashir go ahead. I'm afraid I have to put Lieutenant Dax to work right away.",401
"Promenade","BASHIR: (young, Middle-Eastern male) Jadzia, maybe we could get together later for dinner? Or a drink?",401
"Promenade","DAX: (a Trill female) I'd be delighted.",401
"Promenade","SISKO: He's a little young for you, isn't he?",401
"Promenade","DAX: He's twenty-seven, I'm twenty-eight.",401
