"scenename","scenecontent","ep_number"
"Promenade","SISKO: Three hundred twenty-eight, maybe. Did you tell him about that slug inside of you?",401
"Promenade","DAX: Yes, but Benjamin, he knows I'm a Trill. He finds it fascinating. He's never met a joined species before.",401
"Promenade","SISKO: I wonder if he'd've been as fascinated if you still looked the way you did the last time I saw you.",401
"Promenade","DAX: Perhaps not.",401
"Promenade","SISKO: This is going to take some getting used to.",401
"Promenade","DAX: Don't be ridiculous. I'm still the same old Dax. More or less. ",401
"Infirmary","KIRA: I'm afraid we've had some security problems. Looks like looters got in here.",401
"Infirmary","BASHIR: This'll be perfect. Real frontier medicine.",401
"Infirmary","KIRA: Frontier medicine?",401
"Infirmary","BASHIR: Major, I had my choice of any job in the fleet.",401
"Infirmary","KIRA: Did you?",401
"Infirmary","BASHIR: I didn't want some cushy job or a research grant. I wanted this. The farthest reaches of the galaxy. One of the most remote outposts available. This is where the adventure is. This is where heroes are made. Right here, in the wilderness.",401
"Infirmary","KIRA: This wilderness is my home.",401
"Infirmary","BASHIR: Well, I, I, I didn't mean.",401
"Infirmary","KIRA: The Cardassians left behind a lot of injured people, Doctor. You can make yourself useful by bringing your Federation medicine to the natives. Oh, you'll find them a friendly, simple folk. ",401
"Laboratory","(The Orb in under scrutiny)",401
"Laboratory","SISKO: We do have one advantage. The monks have been studying these things for ten thousand years. I've had our computers set up to interface with their historical data banks.",401
"Laboratory","DAX: That should give us something.",401
"Laboratory","SISKO: Soon as possible, Dax. The eight other orbs are probably in some Cardassian laboratory, being turned upside down and inside out.",401
"Laboratory","DAX: Benjamin, I was happy when I heard you accepted this assignment. I've been worried about you.",401
"Laboratory","SISKO: It's good to see you too, old man.",401
"Laboratory","(Sisko leaves)",401
"Laboratory","DAX: Computer, create a data base for all historical references to the Orbs, including all reports of any unexplained phenomena in Bajoran space.",401
"Laboratory","COMPUTER: Time parameters?",401
"Laboratory","DAX: Ten millennia.",401
"Laboratory","COMPUTER: Initialising data base. Requested function will require two hours to complete.",401
"Laboratory","(Dax releases the forcefield around the Orb. Green flash.) ",401
"Vision - Operating room","(Dax is on an operating table next to an old man)",401
"Vision - Operating room","DAX: Curzon.",401
"Vision - Operating room","(The old man smiles at her, then the symbiot is transferred from him to her.) ",401
"Bridge","(Nightshift on the Enterprise. O'Brien hesitates outside the Ready room.)",401
"Bridge","LIEUTENANT: (woman) The Captain's in the Ready room, Chief. Should I tell him you're here?",401
"Bridge","O'BRIEN: That's okay. Thanks. ",401
"Transporter room","O'BRIEN: Transport me to the Ops pad, Maggie.",401
"Transporter room","MAGGIE: Yes, sir.",401
"Transporter room","PICARD: Mister O'Brien? I understand that I just missed you on the Bridge.",401
"Transporter room","O'BRIEN: Yes, sir. I didn't want to disturb you, sir.",401
"Transporter room","PICARD: Ensign.",401
"Transporter room","(Maggie leaves)",401
"Transporter room","PICARD: This is your favorite transporter room, isn't it?",401
"Transporter room","O'BRIEN: Number three. Yes, sir.",401
"Transporter room","PICARD: You know, yesterday, I called down here and I asked for you without thinking. It won't be quite the same.",401
"Transporter room","O'BRIEN: It's just a transporter room, sir. Permission to disembark, Captain.",401
"Transporter room","PICARD: Permission granted.",401
"Transporter room","O'BRIEN: Energise.",401
"Transporter room","(Picard beams him out, and the Enterprise leaves for its next mission) ",401
"Ops","(A Cardassian warship is on the viewscreen)",401
"Ops","O'BRIEN: Message coming in from their commander, Gul Dukat.",401
"Ops","KIRA: Dukat. He used to be the Cardassian Prefect of Bajor.",401
"Ops","O'BRIEN: He's requesting permission to come aboard to greet us. Surely a coincidence that the Enterprise just left.",401
"Ops","SISKO: Mister O'Brien, tell Gul Dukat I look forward to meeting him. ",401
"Commander's office","DUKAT: Good day, Commander.",401
"Commander's office","SISKO: Gul Dukat.",401
"Commander's office","DUKAT: Excuse my presumption, but this was my office only two weeks ago. I'm not used to being on this side of the desk. I'll be honest with you, Commander. I miss this office. I was not happy to leave it.",401
"Commander's office","SISKO: Drop by any time you're feeling homesick.",401
"Commander's office","DUKAT: You're very gracious. And allow me to assure you that we only want to be helpful in this difficult transition. You're far from the Federation fleet, alone in this remote outpost, with poor defence systems. Your Cardassian neighbours will be quick to respond to any problems you might have.",401
"Commander's office","SISKO: We'll try to keep the dog off your lawn.",401
"Commander's office","DUKAT: So, tell me, what did you think of Kai Opaka? I know you went to the surface to see her. I understand you brought back an Orb. We thought we had all of them. Perhaps we could have an exchange of information, pool our resources?",401
"Commander's office","SISKO: I don't know anything about an Orb.",401
"Commander's office","DUKAT: We will be in close proximity should you wish to reconsider my suggestion. In the meantime, I assume you have no objection to my men enjoying the hospitality of the Promenade. Commander. ",401
"Laboratory","DAX: What do you know about the Denorios Belt?",401
"Laboratory","SISKO: Your basic charged-plasma field. Nobody gets anywhere near it unless they have to.",401
"Laboratory","DAX: In the twenty-second century, a ship carrying Kai Taluno was disabled for several days in the Denorios Belt, where he claims he had a vision.",401
"Laboratory","SISKO: Let me guess. He saw the Celestial Temple of the Prophets.",401
"Laboratory","DAX: Not quite, but he did say that the heavens opened up and nearly swallowed his ship.",401
"Laboratory","SISKO: Are we reduced to chasing metaphors to solve this?",401
"Laboratory","DAX: That's not all. At least five of the orbs were found in the Denorios Belt. There were also been twenty three navigational reports over the years of unusually severe neutrino disturbances in the same area. I've correlated all these reports in one analysis grid. Our Celestial Temple?",401
"Laboratory","SISKO: Worth a look, but we've got Cardassians on our back doorstep. We need to get by them undetected. ",401
"Quark's","(The Cardassians are having a great time, and winning, when Kira and O'Brien walk in.)",401
"Quark's","KIRA: May we have your attention, please? This establishment is being closed.",401
"Quark's","QUARK: What do you mean? You can't do this.",401
"Quark's","O'BRIEN: If you have a problem, sir, you'll have to take it up with Commander Sisko.",401
"Quark's","QUARK: I intend to. This is outrageous. Friends, my apologies. A minor misunderstanding that will be rectified shortly. Give them something to put their winnings into.",401
"Quark's","(A waiter hands over a knapsack.) ",401
"Warship corridor","CARDASSIAN: Because we were winning too much, of course.",401
"Warship corridor","CARDASSIAN 2: Leave it to Starfleet to ruin a fine day.",401
"Warship corridor","(The knapsack is put into a locker where it turns into orange ooze, leaks out to the floor and rebuilds itself as Odo.) ",401
"Runabout Rio Grande","SISKO: Rio Grande to Ops. Initialising pre-launch systems.",401
"Runabout Rio Grande","KIRA [OC]: Confirmed, Rio Grande. ",401
"Ops","O'BRIEN: Scanners are picking up fluctuations in the Cardassian's energy distribution net.",401
"Ops","KIRA: Their computers are crashing. Shields and sensors are down. Odo's done it. Ops to Rio Grande. ",401
"Runabout Rio Grande","KIRA [OC]: You're in business.",401
"Runabout Rio Grande","SISKO: Beginning launch sequence. ",401
"Ops","KIRA: Odo's reached the transport site.",401
"Ops","O'BRIEN: Trying to lock on. I've never done this with a Cardassian transporter. Damn it, what's the problem.",401
"Ops","(He kicks the thing and Odo beams in) KIRA: Nice work, Constable. ",401
"Runabout Rio Grande","DAX: Approaching grid perimeter.",401
"Runabout Rio Grande","SISKO: Slowing to one quarter impulse.",401
"Runabout Rio Grande","DAX: Computer, give me visual bearing two three mark two one seven. Range thirty one hundred kilometres. ",401
"Ops","DAX [OC]: Sensors are picking up unusually high proton counts.",401
"Ops","SISKO [OC]: Setting a new course to those coordinates. ",401
"Runabout Rio Grande","DAX: All external wave intensities are increasing rapidly, but checking. Confirmed. There is no corresponding increase inside the cabin. How is that possible?",401
"Runabout Rio Grande","(The runabout falls into a bright hole in space and starts travelling along an energy tunnel.)",401
"Runabout Rio Grande","SISKO: Sensors are not functioning.",401
"Runabout Rio Grande","DAX: We've lost all contact with the space station. ",401
"Ops","O'BRIEN: Scanners are reading major subspace disruption at their last known coordinates.",401
"Ops","KIRA: What the hell is happening out there?",401
"Ops","O'BRIEN: I don't know. They're just gone. ",401
"Runabout Rio Grande","SISKO: Are your navigational readings going crazy?",401
"Runabout Rio Grande","DAX: I'll recalibrate when I have a moment.",401
"Runabout Rio Grande","SISKO: Take your time.",401
"Runabout Rio Grande","(The runabout comes out into normal space)",401
"Runabout Rio Grande","SISKO: Can you get a fix on our coordinates?",401
"Runabout Rio Grande","DAX: There is a star just under five light years away. No M-class planets Computer, identify closest star system.",401
"Runabout Rio Grande","COMPUTER: Idran, a ternary system consisting of twin O-type companions.",401
"Runabout Rio Grande","SISKO: Idran? That can't be right.",401
"Runabout Rio Grande","DAX: Computer, basis of identification.",401
"Runabout Rio Grande","COMPUTER: Idran is based on the analysis conducted in the twenty-second century by the Quadros-One probe of the Gamma Quadrant.",401
"Runabout Rio Grande","SISKO: The Gamma Quadrant? Seventy thousand light years from Bajor? I'd say we just found our way into a wormhole.",401
"Runabout Rio Grande","DAX: It's not like any wormhole I've ever seen. There were none of the usual resonance waves.",401
"Runabout Rio Grande","SISKO: Could this be how the Orbs found their way into the Bajoran system?",401
"Runabout Rio Grande","DAX: Not an unreasonable hypothesis.",401
"Runabout Rio Grande","SISKO: If it's true, that would mean that this has been here for ten thousand years. Dax, we might have just discovered the first stable wormhole known to exist. Bring us about, Lieutenant.",401
"Runabout Rio Grande","(The wormhole reappears on demand)",401
"Runabout Rio Grande","DAX: I'm modifying the flight programme to compensate for the spatial discontinuities. We should have a smoother ride this time.",401
"Runabout Rio Grande","SISKO: Did you reduce impulse power?",401
"Runabout Rio Grande","DAX: No. Why?",401
"Runabout Rio Grande","SISKO: We're losing velocity.  DAX: Forward velocity down to eighty kph.",401
"Runabout Rio Grande","COMPUTER: Warning. Impulse system overload. Auto shutdown in twelve seconds.",401
"Runabout Rio Grande","SISKO: Disengaging engines.",401
"Runabout Rio Grande","DAX: Velocity at twenty kph. I'm picking up atmosphere.",401
"Runabout Rio Grande","SISKO: Inside a wormhole?",401
"Runabout Rio Grande","DAX: Capable of supporting life. (thud) We've just landed.",401
"Runabout Rio Grande","SISKO: On what? ",401
"Outside the runabout","(Sisko sees a vicious, rocky, lightning-ridden alien planet, but Dax sees they're in a beautiful garden.)",401
"Outside the runabout","DAX: It's beautiful.",401
"Outside the runabout","SISKO: You have a strange eye for beauty, Dax.",401
"Outside the runabout","DAX: You don't think this is one of the most idyllic settings you've ever seen?",401
"Outside the runabout","SISKO: We are standing on a rock face. Do you see the storm?",401
"Outside the runabout","DAX: It's as clear as a summer's day.",401
"Outside the runabout","(An orb is floating nearby)",401
"Outside the runabout","SISKO: You see it, too?",401
"Outside the runabout","DAX: Yes. (gets out a tricorder) Low level ionic pattern. It's probing us.",401
"Outside the runabout","SISKO: Someone's idea of shaking hands, maybe. I am Commander Benjamin Sisko of the United Federation of Planets.",401
"Outside the runabout","(They are both hit with green bolts and thrown back. Both scenes flicker then Dax disappears into the green.)",401
"Outside the runabout","SISKO: Dax!",401
"Outside the runabout","(The ground Sisko is lying on cracks up with bright light coming through and he disappears into ?)",401
"Outside the runabout","(The wormhole opens and an Orb flies out) ",401
"Ops","O'BRIEN: Another neutrino disruption.",401
"Ops","KIRA: Scanners are picking up an object near their last known coordinates. It isn't a ship.",401
"Ops","O'BRIEN: Major, there's something inside it, some kind of lifeform.",401
"Ops","KIRA: Are the Cardassian sensors picking it up?",401
"Ops","O'BRIEN: They should be back online by now. We have to assume they know everything we know.",401
"Ops","KIRA: Yellow alert. Secure Ops. Beam it aboard, Mister O'Brien, but put it in a level one security field.",401
"Ops","O'BRIEN: Aye, sir. Locking on.",401
"Ops","(The orb is beamed in. That disappears to reveal Dax.) ",401
"Limbo","(Meanwhile, Sisko is in a white nowhere listening to a heartbeat and seeing flashes from his past.)",401
"Limbo","Jennifer on the beach.",401
"Limbo","A baseball landing in a catcher's mitt.",401
"Limbo","Kai Opaka.",401
"Limbo","Locutus on a viewscreen.",401
"Limbo","SISKO: Who are you?",401
"Limbo","Jennifer and Sisko kissing.",401
"Limbo","A newborn baby.",401
"Limbo","Jake fishing. Doran on the Saratoga.",401
"Limbo","SISKO: Who are you? ",401
"Beach","JENNIFER: It is corporeal. A physical entity.",401
"Beach","SISKO: What? What did you say? ",401
"Observation lounge","PICARD: It is responding to visual and auditory stimuli. Linguistic communication.",401
"Observation lounge","SISKO: Yes, linguistic communication. Are you capable of communicating with me? ",401
"Bajor Monastery","OPAKA: What are you?",401
"Bajor Monastery","SISKO: My species is known as human. I come from a planet called Earth. ",401
"Fishing pond","JAKE: Earth?",401
"Fishing pond","SISKO: This is what my planet looks like. You and I are very different species. It will take time for us to understand one another.",401
"Fishing pond","JAKE: What is this time? ",401
"Fishing pond","First Officer's log, stardate 46392.7. We're preparing to launch a rescue mission to find Commander Sisko, but first our navigational sensors must be recalibrated to work under the conditions reported by Lieutenant Dax. ",401
"Ops","DAX: It is no ordinary wormhole. My analysis suggests that it isn't even a natural phenomenon.",401
"Ops","BASHIR: Not natural? You mean it was constructed?",401
"Ops","DAX: It's very possible whoever made the Orbs also created this wormhole.",401
"Ops","O'BRIEN: The Cardassians are leaving their position on a course toward the Denorios Belt.",401
"Ops","KIRA: Mister O'Brien, what would it take to move this station to the mouth of the wormhole?",401
"Ops","O'BRIEN: This isn't a starship, Major. We've got six working thrusters to power us and that's it. A hundred sixty million kilometre trip would take two months.",401
"Ops","KIRA: It has to be there tomorrow.",401
"Ops","O'BRIEN: That's not possible, sir.",401
"Ops","KIRA: That wormhole might just reshape the future of this entire quadrant. The Bajorans have to stake a claim to it. And I have to admit that claim will be a lot stronger if there's a Federation presence to back it up.",401
"Ops","DAX: Couldn't you modify the subspace field output of the deflector generators just enough to create a low-level field around the station?",401
"Ops","O'BRIEN: So we could lower the inertial mass?",401
"Ops","DAX: If you can make the station lighter, those six thrusters will be all the power we'd need.",401
"Ops","O'BRIEN: This whole station could break apart like an egg if it doesn't work.",401
"Ops","DAX: Even if it does work, we're still going to need help from Starfleet once we get there.",401
"Ops","O'BRIEN: The Enterprise is still the nearest starship. They could reach us in two days.",401
"Ops","DAX: We should advise Starfleet that we will require their assistance.",401
"Ops","KIRA: You have Ops, Mister O'Brien. Lieutenant, you're with me.",401
"Ops","DAX: Aye, sir.",401
"Ops","KIRA: You too, Doc. Time to be a hero.",401
"Ops","BASHIR: Yes, sir. ",401
"Outer corridor","(You can see the stars through the windows)",401
"Outer corridor","KIRA: Constable.",401
"Outer corridor","ODO: This is a security matter. I'm in charge of security.",401
"Outer corridor","KIRA: Security here, on the station. I cannot justify taking you into this wormhole. We have no idea what we're dealing with in there. It could be hostile.",401
"Outer corridor","ODO: Major, I was found in the Denorios Belt. I don't know where I came from, no idea if there are any others like me. All my life, I've been forced to pass myself off as one of you, always wondering who I really am. Well, the answers to a lot of my questions may be somewhere on the other side of that wormhole. You coming?",401
"Outer corridor","(A runabout takes off.) ",401
"Observation lounge","PICARD: The creature must be destroyed before it destroys us. ",401
"Saratoga Bridge","LOCUTUS [on viewscreen]: It is malevolent. ",401
"Baseball field","BATSMAN: Aggressive. Adversarial. ",401
"Observation lounge","PICARD: It must be destroyed.",401
"Observation lounge","SISKO: I am not your enemy. I was sent here by the people you contacted.",401
"Observation lounge","PICARD: Contacted?",401
"Observation lounge","SISKO: With your devices, your Orbs.",401
"Observation lounge","PICARD: We seek contact with other lifeforms, not corporeal creatures who annihilate us.",401
"Observation lounge","SISKO: I have not come to annihilate anyone. ",401
"Saratoga Bridge","LOCUTUS [on viewscreen]: Destroy it now.",401
"Saratoga Bridge","SISKO: My species respects life above all else. Can you say the same? I do not understand the threat I bring to you, but I am not your enemy. Allow me to prove it. ",401
"Bajor Monastery ","OPAKA: Prove it?",401
"Bajor Monastery ","SISKO: It can be argued that a human is ultimately the sum of his experiences. ",401
"Fishing pond","JAKE: Experiences? What is this?",401
"Fishing pond","SISKO: Memories. Events from my past, like this one.",401
"Fishing pond","JAKE: Past?",401
"Fishing pond","SISKO: Things that happened before now. You have absolutely no idea what I'm talking about.",401
"Fishing pond","JAKE: What comes before now is no different than what is now, or what is to come. It is one's existence.",401
"Fishing pond","SISKO: Then, for you, there is no linear time. ",401
"Beach","JENNIFER: Linear time. what is this?",401
"Beach","SISKO: My species lives in one point in time. And once we move beyond that point, it becomes the past. The future, all that is still to come, does not exist yet for us.",401
"Beach","JENNIFER: Does not exist yet?",401
"Beach","SISKO: That is the nature of linear existence. And if you examine it more closely, you will see that you do not need to fear me. ",401
"Ops","(A big forcefield tries to go up around the station)",401
"Ops","COMPUTER: Partial field established. Instability at twelve percent.",401
"Ops","O'BRIEN: Partial field? Is station's inertial mass low enough to break orbit?",401
"Ops","COMPUTER: Procedure is not recommended.",401
"Ops","O'BRIEN: Damn it, I didn't ask for an opinion. Just tell me whether or not we can get enough thrust with only a partial field established.",401
"Ops","COMPUTER: Affirmative.",401
"Ops","O'BRIEN: All right. Thank you. Initiate transit mode, three-axis stabilisation.",401
"Ops","CREWMAN: Aye, sir.",401
"Ops","O'BRIEN: Engage thrusters.",401
"Ops","COMPUTER: Warning. Field integrity declining. Instability at twenty one percent.",401
"Ops","O'BRIEN: We've got to close that gap in the field or we'll tear ourselves into a million pieces.",401
"Ops","COMPUTER: Warning. Subspace field collapse in sixty seconds.",401
"Ops","O'BRIEN: Computer, transfer energy from the inertial dampers to reinforce the subspace field.",401
"Ops","COMPUTER: Procedure is not recommended.",401
"Ops","O'BRIEN: Damn it, transfer the energy!",401
"Ops","COMPUTER: Unable to comply. Level one safety protocols have cancelled request.",401
"Ops","O'BRIEN: Cancelled?",401
"Ops","COMPUTER: Warning. Subspace field collapse in thirty seconds.",401
"Ops","O'BRIEN: I'm going to transfer it manually. On my mark, redirect the flow to the deflectors. Keep the power balanced.",401
"Ops","CREWMAN: Aye, sir.",401
"Ops","COMPUTER: Field collapse in fifteen seconds.",401
"Ops","O'BRIEN: Now.",401
"Ops","COMPUTER: Field energy now within flight tolerances.",401
"Ops","CREWWOMAN: Good work, sir.",401
"Ops","O'BRIEN: Computer, you and I have to have a little talk. ",401
"Runabout Yangtze Kiang","DAX: The Cardassian warship is in visual range.",401
"Runabout Yangtze Kiang","KIRA: On screen. They're headed right to it.",401
"Runabout Yangtze Kiang","BASHIR: They've got to listen to reason, haven't they? When we warn them what could happen if they go in there.",401
"Runabout Yangtze Kiang","ODO: Doctor, most people in my experience wouldn't know reason if it walked up and shook their hand. You can count Gul Dukat among them.",401
"Runabout Yangtze Kiang","KIRA: This is the Federation ship Yangtze Kiang. Major Kira Nerys in command.",401
"Runabout Yangtze Kiang","DUKAT [on monitor]: Yes, Major?",401
"Runabout Yangtze Kiang","KIRA: Gul Dukat, we know you're headed for the wormhole.",401
"Runabout Yangtze Kiang","DUKAT [on monitor]: Wormhole? What wormhole is that?",401
"Runabout Yangtze Kiang","KIRA: I strongly suggest you do not proceed. We encountered a hostile lifeform inside.",401
"Runabout Yangtze Kiang","DUKAT [on monitor]: Perhaps they will be less hostile to Cardassians than to humans.",401
"Runabout Yangtze Kiang","ODO: Dukat, these people are trying to save you from a lot of trouble.",401
"Runabout Yangtze Kiang","DUKAT [on monitor]: Really? And I suppose you'd also tell me these are not the lifeforms that have sent the Orbs, or that your Commander Sisko is not negotiating for their technology. I thank you for your concern, but I think we'll see for ourselves.",401
"Runabout Yangtze Kiang","(Transmission ends)",401
"Runabout Yangtze Kiang","ODO: So much for reason. ",401
"Park","(Ben and Jennifer having a picnic)",401
"Park","JENNIFER: Jennifer.",401
"Park","SISKO: Yes, that was her name.",401
"Park","JENNIFER: She is part of your existence.",401
"Park","SISKO: She is part of my past. She's no longer alive.",401
"Park","JENNIFER: But she is part of your existence.",401
"Park","SISKO: She was a most important part of my existence, but I lost her some time ago.",401
"Park","JENNIFER: Lost? what is this?",401
"Park","SISKO: In a linear existence, we can't go back to the past to get something we left behind, so it's lost.",401
"Park","JENNIFER: It is inconceivable that any species could exist in such a manner. You are deceiving us.",401
"Park","SISKO: No, this is the truth. This day, this park, it was almost fifteen years ago. Far in the past. It was a day that was very important to me, a day that shaped every day that followed. That is the essence of a linear existence. Each day affects the next.",401
"Park","(we look over to what actually happened that day)",401
"Park","SISKO 2: Listen to it.",401
"Park","JENNIFER 2: To what?",401
"Park","SISKO 2: The sound of children playing. What could be more beautiful?",401
"Park","JENNIFER 2: So you like children?",401
"Park","SISKO 2: That almost sounds like a domestic inquiry.",401
"Park","JENNIFER 2: I've heard Starfleet officers don't want families because they complicate their lives.",401
"Park","SISKO 2: Starfleet officers don't often find mates who want to raise families on a starship.",401
"Park","JENNIFER 2: That almost sounds like a domestic inquiry.",401
"Park","SISKO 2: I think it was.",401
"Park","(They kiss. The alien Jennifer tries kissing her fingers to find out what is going on.)",401
"Park","SISKO: As corporeal entities, humans find physical touch to cause pleasure.",401
"Park","JENNIFER: Pleasure? What is this?",401
"Park","SISKO: Good feelings, happiness ",401
"Saratoga corridor","TACTICAL: But this is your existence.",401
"Saratoga corridor","SISKO: But it's difficult to be here, more difficult than any other memory.",401
"Saratoga corridor","TACTICAL: Why?",401
"Saratoga corridor","SISKO: Because, because this was the day that I lost Jennifer. I don't want to be here.",401
"Saratoga corridor","JENNIFER: Then why do you exist here?",401
"Saratoga corridor","SISKO: I don't understand.",401
"Saratoga corridor","JENNIFER: You exist here. ",401
"Limbo","SISKO: What's wrong? What's happening?",401
"Limbo","(Dukat's ship passes through the wormhole into the Gamma quadrant) ",401
"Runabout","DAX: We should be reaching the wormhole coordinates in two minutes.",401
"Runabout","KIRA: Slowing to one-third imp",401
"Runabout","(The wormhole opens and shuts again.) ",401
"Limbo","SISKO: Are you still there? What just happened? ",401
"Beach","JENNIFER: More of your kind.",401
"Beach","SISKO: Another ship in the wormhole?",401
"Beach","JENNIFER: Wormhole? What is this?",401
